tweet_id,timestamp,text,rating_numerator,rating_denominator,name,retweet_count,favorite_count,dog_breed,rating,dog_stage
679132435750195208,2015-12-22 02:52:45+00:00,This is Louis. He's a river dancer. His friends think it's badass. All are very supportive. 10/10 for Louis https://t.co/qoIvjKMY58,10,10,Louis,1036,2714,Scottish_deerhound,100.0,None
679148763231985668,2015-12-22 03:57:37+00:00,I know everyone's excited for Christmas but that doesn't mean you can send in reindeer. We only rate dogs... 8/10 https://t.co/eWjWgbOCYL,8,10,None,927,2560,Italian_greyhound,80.0,None
679158373988876288,2015-12-22 04:35:49+00:00,This is Rubio. He has too much skin. 11/10 https://t.co/NLOHmlENag,11,10,Rubio,7253,19464,pug,110.00000000000001,None
679462823135686656,2015-12-23 00:45:35+00:00,Meet Hurley. He's the curly one. He hugs every other dog he sees during his walk. 11/10 for spreading the love https://t.co/M6vqkt2GKV,11,10,Hurley,17037,29449,toy_poodle,110.00000000000001,None
679475951516934144,2015-12-23 01:37:45+00:00,This is Evy. She doesn't want to be a Koala. 9/10 https://t.co/VITeF0Kl9L,9,10,Evy,585,1928,Maltese_dog,90.0,None
679511351870550016,2015-12-23 03:58:25+00:00,Say hello to William. He makes fun of others because he's terrified of his own deep-seated insecurities. 7/10 https://t.co/bwuV6FlRxr,7,10,William,1149,3078,Chihuahua,70.0,None
679530280114372609,2015-12-23 05:13:38+00:00,Guys this really needs to stop. We've been over this way too many times. This is a giraffe. We only rate dogs.. 7/10 https://t.co/yavgkHYPOC,7,10,a,1888,4376,dalmatian,70.0,None
679722016581222400,2015-12-23 17:55:32+00:00,This is Mike. He is a Jordanian Frito Pilates. Frowning because he can't see directly in front of him. 8/10 https://t.co/NL5QJwdEpF,8,10,Mike,426,1540,boxer,80.0,None
679736210798047232,2015-12-23 18:51:56+00:00,This pup's name is Sabertooth (parents must be cool). Ears for days. Jumps unannounced. 9/10 would pet diligently https://t.co/iazoiNUviP,9,10,None,718,1917,French_bulldog,90.0,None
679777920601223168,2015-12-23 21:37:40+00:00,This is Rinna. She's melting. 10/10 get inside pupper https://t.co/PA0czwucsb,10,10,Rinna,998,2858,bloodhound,100.0,pupper
679844490799091713,2015-12-24 02:02:12+00:00,This is Willie. He's floating away and needs your assistance. Please someone help Willie. 10/10 https://t.co/MJqygWqt8X,10,10,Willie,687,2188,Airedale,100.0,None
679854723806179328,2015-12-24 02:42:51+00:00,This is Bruce. He's a rare pup. Covered in Frosted Flakes. Nifty gold teeth. Overall good dog. 7/10 would pet firmly https://t.co/RtxxACzZ8A,7,10,Bruce,1103,2616,chow,70.0,None
679862121895714818,2015-12-24 03:12:15+00:00,"""Dammit hooman I'm jus trynna lik the fler"" 11/10 https://t.co/eRZRI8OTj7",11,10,None,557,2255,EntleBucher,110.00000000000001,None
680100725817409536,2015-12-24 19:00:23+00:00,This pupper is not coming inside until she catches a snowflake on her tongue. 11/10 the determination is palpable https://t.co/lvMYbmKq8H,11,10,None,1253,3308,golden_retriever,110.00000000000001,pupper
680115823365742593,2015-12-24 20:00:22+00:00,This is Ozzy. He woke up 2 minutes before he had to be ready for the Christmas party. 9/10 classic Ozzy https://t.co/Kt9vmw0Fap,9,10,Ozzy,830,2500,pug,90.0,None
680130881361686529,2015-12-24 21:00:12+00:00,This is Reggie. His Santa hat is a little big. 10/10 he's still having fun https://t.co/w0dcGXq7qK,10,10,Reggie,857,2119,Maltese_dog,100.0,None
680145970311643136,2015-12-24 22:00:10+00:00,Say hello to Kawhi. He was doing fine until his hat fell off. He got it back though. 10/10 deep breaths pupper https://t.co/N5pM6WBx7e,10,10,Kawhi,1563,3317,miniature_poodle,100.0,pupper
680161097740095489,2015-12-24 23:00:17+00:00,Meet Goliath. He's an example of irony. Head is phenomenally round. Wants to be an ornament. 12/10 would hug gently https://t.co/72Dil0Aktw,12,10,Goliath,672,2145,bluetick,120.0,None
680191257256136705,2015-12-25 01:00:07+00:00,Here's a sleepy Christmas pupper 11/10 https://t.co/KXg0f8GNQ9,11,10,None,442,1983,Brittany_spaniel,110.00000000000001,pupper
680473011644985345,2015-12-25 19:39:43+00:00,"This is Hector. He thinks he's a hammer. Silly Hector. You're a pupper, not a hammer. 10/10 https://t.co/OdUFuZIXiI",10,10,Hector,674,2347,Lakeland_terrier,100.0,pupper
680494726643068929,2015-12-25 21:06:00+00:00,Here we have uncovered an entire battalion of holiday puppers. Average of 11.26/10 https://t.co/eNm2S6p9BD,26,10,None,440,1576,kuvasz,260.0,None
680497766108381184,2015-12-25 21:18:05+00:00,Meet Percy. He's a Latvian Yuletide Heineken. Refuses to take off sweater. Kinda feisty. 12/10 would keep in pocket https://t.co/QGM5Fcuv7s,12,10,Percy,1736,3892,Chihuahua,120.0,None
680609293079592961,2015-12-26 04:41:15+00:00,This is Brody. That is his chair. He loves his chair. Never leaves it. 9/10 might be stuck actually https://t.co/WvJRg0XJit,9,10,Brody,629,2415,French_bulldog,90.0,None
680801747103793152,2015-12-26 17:25:59+00:00,Great picture here. Dog on the right panicked &amp; forgot about his tongue. Middle green dog must've fainted. All 10/10 https://t.co/31npKUAox0,10,10,None,742,2192,pug,100.0,None
680889648562991104,2015-12-26 23:15:17+00:00,This is Cheesy. It's her birthday. She's patiently waiting to eat her party muffin. 9/10 happy birthday pup https://t.co/cH2H7mch2H,9,10,Cheesy,326,1615,Shetland_sheepdog,90.0,None
680913438424612864,2015-12-27 00:49:49+00:00,Meet Griswold. He's dapper as hell. Already pumped for next Christmas. 11/10 https://t.co/5NrpNDyFzN,11,10,Griswold,563,2215,Pomeranian,110.00000000000001,None
680934982542561280,2015-12-27 02:15:25+00:00,Say hello to Sadie. She's a Tortellini Sidewinder. Very jubilant pup. Seems loyal. Leaves on point. 10/10 petable af https://t.co/g2bTu4ayPl,10,10,Sadie,394,1923,Labrador_retriever,100.0,None
680940246314430465,2015-12-27 02:36:20+00:00,This is Alice. She's an idiot. 4/10 https://t.co/VQXdwJfkyS,4,10,Alice,937,2928,soft-coated_wheaten_terrier,40.0,None
680970795137544192,2015-12-27 04:37:44+00:00,I thought I made this very clear. We only rate dogs. Stop sending other things like this shark. Thank you... 9/10 https://t.co/CXSJZ4Stk3,9,10,None,586,2217,pug,90.0,None
681193455364796417,2015-12-27 19:22:30+00:00,This is Aspen. He's astronomically fluffy. I wouldn't stop petting this dog if the world was ending around me 11/10 https://t.co/oBlgL9nxpx,11,10,Aspen,1340,3425,Pomeranian,110.00000000000001,None
681231109724700672,2015-12-27 21:52:07+00:00,I just love this pic. 11/10 this pupper is going places https://t.co/P16uhh1PbI,11,10,None,441,2244,Irish_setter,110.00000000000001,pupper
681261549936340994,2015-12-27 23:53:05+00:00,Say hello to Panda. He's a Quackadilly Shooster. Not amused by your fake ball throwing motion. 9/10 would hug lots https://t.co/wL1iDvbcVk,9,10,Panda,236,1336,Tibetan_terrier,90.0,None
681281657291280384,2015-12-28 01:12:59+00:00,Meet Sarge. His parents signed him up for dancing lessons but his true passion is roller coasters 11/10 very petable https://t.co/KvVoBIgkje,11,10,Sarge,998,2967,Saint_Bernard,110.00000000000001,None
681297372102656000,2015-12-28 02:15:26+00:00,"This is actually a lion. We only rate dogs. For the last time please only send dogs. Thank u.
12/10 would still pet https://t.co/Pp26dMQxap",12,10,actually,857,2964,Lhasa,120.0,None
681320187870711809,2015-12-28 03:46:05+00:00,This is Glacier. He's a very happy pup. Loves to sing in the sunlight. 11/10 https://t.co/jTBPqKgkz7,11,10,Glacier,672,2417,Samoyed,110.00000000000001,None
681339448655802368,2015-12-28 05:02:37+00:00,This is Asher. He's not wearing a seatbelt or keeping both paws on the wheel. Absolute menace on the roadways. 9/10 https://t.co/V3SWuHACkh,9,10,Asher,3709,8569,kuvasz,90.0,None
681523177663676416,2015-12-28 17:12:42+00:00,This is Carly. She's actually 2 dogs fused together. Very innovative. Probably has superpowers. 12/10 for double dog https://t.co/GQn2IopLud,12,10,Carly,5216,13200,Norfolk_terrier,120.0,None
681579835668455424,2015-12-28 20:57:50+00:00,This is Apollo. He thought you weren't coming back so he had a mental breakdown. 8/10 we've all been there https://t.co/ojUBrDCHLT,8,10,Apollo,1179,3260,Rottweiler,80.0,None
681610798867845120,2015-12-28 23:00:52+00:00,*collapses* 12/10 https://t.co/C7M8mnzHIK,12,10,None,419,1735,toy_poodle,120.0,None
681654059175129088,2015-12-29 01:52:46+00:00,This is Toffee. He's a happy pupper. Appears dangerously fluffy. Extraordinarily spherical. 12/10 would pet firmly https://t.co/oEXEKt3MHu,12,10,Toffee,820,2427,Pomeranian,120.0,pupper
681694085539872773,2015-12-29 04:31:49+00:00,This is Bo. He's a Benedoop Cumbersnatch. Seems frustrated with own feet. Portable as hell. 11/10 very solid pupper https://t.co/TONMhRoQh7,11,10,Bo,3698,11829,toy_poodle,110.00000000000001,pupper
681891461017812993,2015-12-29 17:36:07+00:00,Say hello to Charlie. He's scholarly af. Quite intimidating with all his pupper knowledge 10/10 even built that fire https://t.co/9KThv6z8u5,10,10,Charlie,746,2277,Chihuahua,100.0,pupper
681981167097122816,2015-12-29 23:32:35+00:00,This is Jimothy. He's a Trinidad Poliwhirl. Father was a velociraptor. Exceptionally unamused. 12/10 would adopt https://t.co/VwdIk0OwVx,12,10,Jimothy,922,2601,Labrador_retriever,120.0,None
682032003584274432,2015-12-30 02:54:35+00:00,This is Ulysses. He likes holding hands and his eyes are magic. 11/10 https://t.co/gPmJHmtgak,11,10,Ulysses,1798,6072,schipperke,110.00000000000001,None
682259524040966145,2015-12-30 17:58:40+00:00,Meet Jax. He's an Iglesias Hufflepoof. Quite the jokester. Takes it too far sometimes. Can be very hurtful. 9/10 https://t.co/i5TeG0KYcW,9,10,Jax,1079,3817,Siberian_husky,90.0,None
682303737705140231,2015-12-30 20:54:22+00:00,This is Todo. He's screaming because he doesn't want to wear his sweater or a seat belt. 9/10 gotta buckle up pup https://t.co/Nm8Spw4HbD,9,10,Todo,887,2828,Airedale,90.0,None
682389078323662849,2015-12-31 02:33:29+00:00,"Meet Brody. He's a Downton Abbey Falsetto. Addicted to grating cheese. He says he can stop but we know he can't
9/10 https://t.co/vBeiQq6SaZ",9,10,Brody,424,1544,curly-coated_retriever,90.0,None
682393905736888321,2015-12-31 02:52:40+00:00,This is Kreg. He's riding an invisible jet ski. 11/10 that's downright legendary https://t.co/BA5AV5dx6Y,11,10,Kreg,598,2078,vizsla,110.00000000000001,None
682429480204398592,2015-12-31 05:14:01+00:00,"I know we joke around on here, but this is getting really frustrating. We rate dogs. Not T-Rex. Thank you... 8/10 https://t.co/5aFw7SWyxU",8,10,None,1046,3187,whippet,80.0,None
682638830361513985,2015-12-31 19:05:54+00:00,I have no words. Just a magnificent pup. 12/10 https://t.co/viwWHZgX8j,12,10,None,535,1913,English_springer,120.0,None
682662431982772225,2015-12-31 20:39:41+00:00,Meet Joey and Izzy. Joey only has one ear that works and Izzy wants 2015 to be over already. Both great pups. 11/10s https://t.co/WgQTIQ93BB,11,10,Joey,988,2819,beagle,110.00000000000001,None
682750546109968385,2016-01-01 02:29:49+00:00,Meet Taco. He's a speckled Garnier Fructis. Loves to shadow box. Ears out of control. Friend clearly impressed 9/10 https://t.co/85X1GHohFr,9,10,Taco,398,1408,English_setter,90.0,None
683030066213818368,2016-01-01 21:00:32+00:00,This is Lulu. She's contemplating all her unreached 2015 goals and daydreaming of a more efficient tomorrow. 10/10 https://t.co/h3ScYuz77J,10,10,Lulu,671,2002,boxer,100.0,None
683098815881154561,2016-01-02 01:33:43+00:00,aahhhhkslaldhwnxmzbbs 12/10 for being da smooshiest https://t.co/UOPdXmUz4H,12,10,None,589,2002,golden_retriever,120.0,None
683111407806746624,2016-01-02 02:23:45+00:00,This is Larry. He thought the New Year's parties were tonight. 10/10 poor pupper. Maybe next year https://t.co/h3X0jK8MVM,10,10,Larry,818,3148,cocker_spaniel,100.0,pupper
683142553609318400,2016-01-02 04:27:31+00:00,Meet Brandy. She's a member of the Bloods. Menacing criminal pupper. Soft spot for flowers tho. 9/10 pet w caution https://t.co/hhIA3coiAJ,9,10,Brandy,939,2649,Leonberg,90.0,pupper
683357973142474752,2016-01-02 18:43:31+00:00,"""Have a seat, son. There are some things we need to discuss"" 10/10 https://t.co/g4G5tvfTVd",10,10,None,825,2674,Pembroke,100.0,None
683391852557561860,2016-01-02 20:58:09+00:00,"Say hello to Jack (pronounced ""Kevin""). He's a Virgo Episcopalian. Can summon rainbows. 11/10 magical as hell https://t.co/YHXrdUTHd6",11,10,Jack,2181,7059,French_bulldog,110.00000000000001,None
683449695444799489,2016-01-03 00:47:59+00:00,I just want to be friends with this dog. Appears to be into the sports. A true brobean. 10/10 would introduce to mom https://t.co/1Z7Q6svWpe,10,10,None,1459,3584,Lakeland_terrier,100.0,None
683462770029932544,2016-01-03 01:39:57+00:00,"""Hello forest pupper I am house pupper welcome to my abode"" (8/10 for both) https://t.co/qFD8217fUT",8,10,None,620,2244,Italian_greyhound,80.0,pupper
683481228088049664,2016-01-03 02:53:17+00:00,Meet Banjo. He's a Peppercorn Shoop Da Whoop. Nails look lethal. Skeptical of luminescent orb 11/10 stay woke pupper https://t.co/H7NZFumpKq,11,10,Banjo,904,2454,keeshond,110.00000000000001,pupper
683498322573824003,2016-01-03 04:01:13+00:00,This is Griffin. He's desperate for both a physical and emotion connection. 11/10 I'd hug the hell out of Griffin https://t.co/ObWcOEekt0,11,10,Griffin,874,2937,Airedale,110.00000000000001,None
683742671509258241,2016-01-03 20:12:10+00:00,Meet Sebastian. He's a womanizer. Romantic af. Always covered in flower petals. Also a poet. 11/10 dreamy as hell https://t.co/eoL1bCpWCg,11,10,Sebastian,3013,5987,Pembroke,110.00000000000001,None
683773439333797890,2016-01-03 22:14:26+00:00,This is Buddy. He's gaining strength. Currently an F4 tornado with wind speeds up to 260mph. Very devastating. 9/10 https://t.co/qipZbshNsR,9,10,Buddy,1221,3079,miniature_pinscher,90.0,None
683828599284170753,2016-01-04 01:53:37+00:00,Breathtaking pupper here. Should be on the cover of Dogue. Top-notch tongue. Appears considerably fluffy. 12/10 https://t.co/Eeh3yfdglS,12,10,None,973,2590,malamute,120.0,pupper
683834909291606017,2016-01-04 02:18:42+00:00,Here we see a faulty pupper. Might need to replace batteries. Try turning off &amp; back on again. 9/10 would still pet https://t.co/O1E4AtHVxO,9,10,None,1025,2420,Maltese_dog,90.0,pupper
683857920510050305,2016-01-04 03:50:08+00:00,Meet Sadie. She fell asleep on the beach and her friends buried her. 10/10 can't trust fellow puppers these days https://t.co/LoKVvc1xAW,10,10,Sadie,1021,3528,bluetick,100.0,None
684097758874210310,2016-01-04 19:43:10+00:00,Say hello to Lupe. This is how she sleeps. 10/10 impressive really https://t.co/Fz6iZWlk8C,10,10,Lupe,1299,3800,Labrador_retriever,100.0,None
684177701129875456,2016-01-05 01:00:50+00:00,This is Kulet. She's very proud of the flower she picked. Loves it dearly. 10/10 now I want a flower https://t.co/myUUwqJIs7,10,10,Kulet,594,1866,chow,100.0,None
684188786104872960,2016-01-05 01:44:52+00:00,"""Yo Boomer I'm taking a selfie, grab your stick""
""Ok make sure to get this rad hole I just dug in there""

Both 10/10 https://t.co/e0gbl9VFpA",10,10,None,1054,3227,kelpie,100.0,None
684195085588783105,2016-01-05 02:09:54+00:00,This is Tino. He really likes corndogs. 9/10 https://t.co/cUxGtnBfc2,9,10,Tino,457,1765,Chihuahua,90.0,None
684222868335505415,2016-01-05 04:00:18+00:00,Someone help the girl is being mugged. Several are distracting her while two steal her shoes. Clever puppers 121/110 https://t.co/1zfnTJLt55,121,110,None,1241,3524,soft-coated_wheaten_terrier,110.00000000000001,None
684241637099323392,2016-01-05 05:14:53+00:00,This is Obi. He got camera shy. 12/10 https://t.co/feiPiq7z94,12,10,Obi,2954,7500,Pembroke,120.0,None
684460069371654144,2016-01-05 19:42:51+00:00,This is Jeph. He's a Western Sagittarius Dookmarriot. Frightened by leaf. Caught him off guard. 10/10 calm down Jeph https://t.co/bicyOV6lju,10,10,Jeph,503,1820,Labrador_retriever,100.0,None
684481074559381504,2016-01-05 21:06:19+00:00,Meet Pippa. She's an Elfin High Feta. Compact af. Easy to transport. Great for vacations. 10/10 would keep in pocket https://t.co/nBtDeZ4yAb,10,10,Pippa,1072,3573,Chihuahua,100.0,None
684594889858887680,2016-01-06 04:38:35+00:00,"""FOR THE LAST TIME I DON'T WANNA PLAY TWISTER ALL THE SPOTS ARE GREY DAMN IT CINDY"" ...10/10 https://t.co/uhQNehTpIu",10,10,None,3173,8196,Weimaraner,100.0,None
684800227459624960,2016-01-06 18:14:31+00:00,Meet Theodore. He's dapper as hell. Probably owns horses. Uses 'summer' as a verb. Often quotes philosophers. 11/10 https://t.co/J3Ld4fRbSy,11,10,Theodore,906,2515,miniature_schnauzer,110.00000000000001,None
684902183876321280,2016-01-07 00:59:40+00:00,This is Perry. He's an Augustus Gloopster. Very condescending. Makes up for it with the sneaky tongue slip. 11/10 https://t.co/JVvIrUmTkR,11,10,Perry,467,1719,Pembroke,110.00000000000001,None
684914660081053696,2016-01-07 01:49:14+00:00,"""Hello yes I'll just get one of each color thanks"" 12/10 for all https://t.co/AMDsllQs7a",12,10,None,1326,3227,Labrador_retriever,120.0,None
684926975086034944,2016-01-07 02:38:10+00:00,Meet Bruiser &amp; Charlie. They are the best of pals. Been through it all together. Both 11/10. 1 like=1 friendship https://t.co/PEXHuvSVD4,11,10,Bruiser,417,3226,Labrador_retriever,110.00000000000001,None
685169283572338688,2016-01-07 18:41:01+00:00,Meet Gerbald. He just found out he's adopted. Poor pupper. Snazzy tongue tho. 11/10 would hold close in time of need https://t.co/UfGkB9Wrud,11,10,Gerbald,1281,3788,Bernese_mountain_dog,110.00000000000001,pupper
685198997565345792,2016-01-07 20:39:06+00:00,This is Alfie. That is his time machine. He's very proud of it. Without him life as we know it would not exist 11/10 https://t.co/530Yfbl5xo,11,10,Alfie,589,2144,Old_English_sheepdog,110.00000000000001,None
685268753634967552,2016-01-08 01:16:17+00:00,This is Hubertson. He's a Carmel Haberdashery. Enjoys long summer days on his boat. Very peaceful pupper. 10/10 https://t.co/vzCl35fKlZ,10,10,Hubertson,1078,2846,pug,100.0,pupper
685307451701334016,2016-01-08 03:50:03+00:00,Say hello to Petrick. He's an Altostratus Floofer. Just had a run in with a trash bag. Groovy checkered floor. 11/10 https://t.co/rwW7z1JAOF,11,10,Petrick,397,1929,Pomeranian,110.00000000000001,floofer
685321586178670592,2016-01-08 04:46:13+00:00,This is Rocky. He sleeps like a psychopath. 10/10 quality tongue slip https://t.co/MbgG95mUdu,10,10,Rocky,580,2451,Boston_bull,100.0,None
685325112850124800,2016-01-08 05:00:14+00:00,"""Tristan do not speak to me with that kind of tone or I will take away the Xbox."" 10/10 https://t.co/VGPH0TfESw",10,10,None,3590,8693,golden_retriever,100.0,None
685532292383666176,2016-01-08 18:43:29+00:00,"For the last time, WE. DO. NOT. RATE. BULBASAUR. We only rate dogs. Please only send dogs. Thank you ...9/10 https://t.co/GboDG8WhJG",9,10,None,1048,2814,collie,90.0,None
685641971164143616,2016-01-09 01:59:19+00:00,This is Otis. He just passed a cop while going 61 in a 45. Very nervous pupper. 7/10 https://t.co/jJS8qQeuNO,7,10,Otis,700,2699,Lakeland_terrier,70.0,pupper
685663452032069632,2016-01-09 03:24:40+00:00,"Meet Brooks. He's confused by the almighty ball of tennis. 12/10 

(vid by @PDolan37) https://t.co/AcVWe39nmM",12,10,Brooks,1335,2979,Chesapeake_Bay_retriever,120.0,None
685906723014619143,2016-01-09 19:31:20+00:00,This is Olive. He's stuck in a sleeve. 9/10 damn it Olive https://t.co/NnLjg6BgyF,9,10,Olive,2598,6911,Yorkshire_terrier,90.0,None
685943807276412928,2016-01-09 21:58:42+00:00,This is the newly formed pupper a capella group. They're just starting out but I see tons of potential. 8/10 for all https://t.co/wbAcvFoNtn,8,10,the,536,1499,papillon,80.0,pupper
685973236358713344,2016-01-09 23:55:38+00:00,This is Lorelei. She's contemplating her existence and the eventual heat death of the universe. 11/10 very majestic https://t.co/xbUoULOIS8,11,10,Lorelei,477,1941,Siberian_husky,110.00000000000001,None
686007916130873345,2016-01-10 02:13:27+00:00,This pupper has a magical eye. 11/10 I can't stop looking at it https://t.co/heAGpKTpPW,11,10,None,367,2285,Rhodesian_ridgeback,110.00000000000001,pupper
686034024800862208,2016-01-10 03:57:12+00:00,Your fav crew is back and this time they're embracing cannabis culture. 12/10 for all https://t.co/oSvRDuMm1D,12,10,None,1039,2853,Great_Dane,120.0,None
686050296934563840,2016-01-10 05:01:51+00:00,This is Flávio. He's a Macedonian Poppycock. 97% floof. Jubilant af. 11/10 personally I'd pet the hell out of https://t.co/BUyX7isHRg,11,10,Flávio,664,2066,Pomeranian,110.00000000000001,None
686358356425093120,2016-01-11 01:25:58+00:00,Heartwarming scene here. Son reuniting w father after coming home from deployment. Very moving. 10/10 for both pups https://t.co/95JJevQOWW,10,10,None,602,2001,pug,100.0,None
686377065986265092,2016-01-11 02:40:19+00:00,Meet Birf. He thinks he's gone blind. 10/10 very frightened pupper https://t.co/oDkspjNWYX,10,10,Birf,516,2052,German_shepherd,100.0,pupper
686386521809772549,2016-01-11 03:17:53+00:00,Say hello to Crimson. He's a Speckled Winnebago. Main passions are air hockey &amp; parkour. 11/10 would pet thoroughly https://t.co/J5aI7SjzDc,11,10,Crimson,792,3017,Yorkshire_terrier,110.00000000000001,None
686606069955735556,2016-01-11 17:50:18+00:00,"Meet Horace. He was practicing his levitation, minding his own business when a rogue tennis ball spooked him. 10/10 https://t.co/tB9xYjMyZd",10,10,Horace,492,1753,Labrador_retriever,100.0,None
686618349602762752,2016-01-11 18:39:05+00:00,This is Olivia. She just saw an adult wearing crocs. 11/10 poor pupper. No one should witness such a thing https://t.co/yJVTi1DjJc,11,10,Olivia,1240,3417,Rottweiler,110.00000000000001,pupper
686683045143953408,2016-01-11 22:56:10+00:00,This is Mona. She's a Yarborough Splishnsplash. Lost body during Nam. 11/10 revolutionary pupper https://t.co/pgD6h0yhgz,11,10,Mona,735,2612,Norwich_terrier,110.00000000000001,pupper
686730991906516992,2016-01-12 02:06:41+00:00,I just love this picture. 12/10 lovely af https://t.co/Kc84eFNhYU,12,10,None,1094,3814,Tibetan_mastiff,120.0,None
687096057537363968,2016-01-13 02:17:20+00:00,This pupper's New Year's resolution was to become a Hershey's kiss. 11/10 she's super pumped about it https://t.co/D7jYj6vdwC,11,10,None,552,2081,Labrador_retriever,110.00000000000001,pupper
687124485711986689,2016-01-13 04:10:18+00:00,Say hello to Samson. He's a Firecracker Häagen-Dazs. 11/10 objects in mirror may be more petable than they appear https://t.co/03vR9dn7jy,11,10,Samson,462,2019,beagle,110.00000000000001,None
687127927494963200,2016-01-13 04:23:58+00:00,Meet Gordon. He's an asshole. 9/10 would still pet https://t.co/a34N7QwKbb,9,10,Gordon,2058,4981,pug,90.0,None
687312378585812992,2016-01-13 16:36:55+00:00,"""You got any games on your phone"" 7/10 for invasive brown Dalmatian pupper https://t.co/yzGR9xjE9Q",7,10,None,1737,4020,Weimaraner,70.0,pupper
687317306314240000,2016-01-13 16:56:30+00:00,This is Tyrone. He's a leaf wizard. Self-motivated. No eyes (tragic). Inspirational af. 11/10 enthusiasm is tangible https://t.co/pRp1Npucbz,11,10,Tyrone,8360,18685,Shih-Tzu,110.00000000000001,None
687460506001633280,2016-01-14 02:25:31+00:00,This is Kramer. He's a Picasso Tortellini. Tie couldn't be more accurate. Confident af. Runs his own business. 10/10 https://t.co/jIcVW0xxmH,10,10,Kramer,492,1908,Boston_bull,100.0,None
687480748861947905,2016-01-14 03:45:57+00:00,Another magnificent photo. 12/10 https://t.co/X5w387K5jr,12,10,None,222,1478,English_springer,120.0,None
687494652870668288,2016-01-14 04:41:12+00:00,This is Marq. He stole this car. 7/10 wtf Marq? https://t.co/MHScqo5l8c,7,10,Marq,530,1764,Rottweiler,70.0,None
687664829264453632,2016-01-14 15:57:26+00:00,Meet Opal. He's a Belgian Dijon Poofster. Upset because his hood makes him look like blond Justin Timberlake. 11/10 https://t.co/IAt3jRZ5ez,11,10,Opal,471,1807,pug,110.00000000000001,None
687704180304273409,2016-01-14 18:33:48+00:00,Say hello to Blakely. He thinks that's a hat. Silly pupper. That's a nanner. 9/10 https://t.co/UwOV1jqKRt,9,10,Blakely,767,2245,miniature_pinscher,90.0,pupper
687807801670897665,2016-01-15 01:25:33+00:00,Meet Trooper &amp; Maya. Trooper protects Maya from bad things like dognappers and Comcast. So touching. 11/10 for both https://t.co/c98k1IoZKy,11,10,Trooper,660,2204,Staffordshire_bullterrier,110.00000000000001,None
687818504314159109,2016-01-15 02:08:05+00:00,With great pupper comes great responsibility. 12/10 https://t.co/hK6xB042EP,12,10,None,867,2282,Lakeland_terrier,120.0,pupper
687826841265172480,2016-01-15 02:41:12+00:00,This is Louis. He's a rollercoaster of emotions. Incalculably fluffy. 12/10 would pet firmly https://t.co/17RGvOZO9P,12,10,Louis,1013,2528,Pomeranian,120.0,None
688064179421470721,2016-01-15 18:24:18+00:00,This is Kilo. He's a Pouncing Brioche. Really likes snow. 11/10 https://t.co/GS76SfkraY,11,10,Kilo,325,1602,Eskimo_dog,110.00000000000001,None
688116655151435777,2016-01-15 21:52:49+00:00,Please send dogs. I'm tired of seeing other stuff like this dangerous pirate. We only rate dogs. Thank you... 10/10 https://t.co/YdLytdZOqv,10,10,None,701,2619,pug,100.0,None
688519176466644993,2016-01-17 00:32:18+00:00,This pupper is sprouting a flower out of her head. 12/10 revolutionary af https://t.co/glmvQBRjv4,12,10,None,661,2156,Pembroke,120.0,pupper
688547210804498433,2016-01-17 02:23:42+00:00,This is Frönq. He got caught stealing a waffle. Damn it Frönq. 9/10 https://t.co/7ycWCUrjmZ,9,10,Frönq,627,2406,papillon,90.0,None
688789766343622656,2016-01-17 18:27:32+00:00,Meet Pubert. He's a Kerplunk Rumplestilt. Cannot comprehend flower. Flawless tongue. 8/10 would pat head approvingly https://t.co/2TWxg0rgyG,8,10,Pubert,605,2062,American_Staffordshire_terrier,80.0,None
