tweet_id,timestamp,text,rating_numerator,rating_denominator,name,retweet_count,favorite_count,dog_breed,rating,dog_stage
720389942216527872,2016-04-13 23:15:21+00:00,This is Ralphé. He patrols the lake. Looking for babes. 11/10 https://t.co/Pb6iMmo0wk,11,10,Ralphé,2270,5885,Pembroke,110.00000000000001,None
720415127506415616,2016-04-14 00:55:25+00:00,Garden's coming in nice this year. 10/10 https://t.co/5Lra3e4rrw,10,10,None,1367,3808,Rottweiler,100.0,None
720775346191278080,2016-04-15 00:46:48+00:00,This is Berkeley. He's in a predicament. 10/10 someone help him https://t.co/XSEXdQupej,10,10,Berkeley,571,2260,Newfoundland,100.0,None
720785406564900865,2016-04-15 01:26:47+00:00,This is Archie. He hears everything you say. Doesn't matter where you are. 12/10 https://t.co/0l4I8famYp,12,10,Archie,700,2864,Chihuahua,120.0,None
721001180231503872,2016-04-15 15:44:11+00:00,This is Oliver. Bath time is upon him. His fear of the wetness postpones his ultimate pupper destiny. 11/10 https://t.co/AFzzKqR4tT,11,10,Oliver,552,2351,Samoyed,110.00000000000001,pupper
722613351520608256,2016-04-20 02:30:23+00:00,Meet Schnitzel. He's a Tropicana Floofboop. Getting too big for his favorite basket. 12/10 just so damn fluffy https://t.co/qjd0UJKYUY,12,10,Schnitzel,1496,4596,Labrador_retriever,120.0,None
722974582966214656,2016-04-21 02:25:47+00:00,Happy 4/20 from the squad! 13/10 for all https://t.co/eV1diwds8a,4,20,None,1443,3779,Great_Dane,20.0,None
724046343203856385,2016-04-24 01:24:35+00:00,"This is Sarge. Not even he knows what his tongue is doing, but it's pretty damn spectacular. 10/10 https://t.co/pIQEdbBxdL",10,10,Sarge,513,2457,boxer,100.0,None
724049859469295616,2016-04-24 01:38:33+00:00,This is Kreggory. He just took a look at his student debt. 10/10 can't even comprehend it https://t.co/XTsZTgilnT,10,10,Kreggory,1623,3989,Border_collie,100.0,None
724405726123311104,2016-04-25 01:12:38+00:00,This is Ashleigh. She's having Coachella withdrawals. Didn't even go tho. 10/10 stay strong pupper https://t.co/nRUaKWnJfH,10,10,Ashleigh,1515,4882,golden_retriever,100.0,pupper
724983749226668032,2016-04-26 15:29:30+00:00,This is Fred-Rick. He dabbles in parkour. The elevation gives him power. 12/10 hopefully visiting a mailbox near you https://t.co/qFqLtudIiD,12,10,Fred,1172,3452,golden_retriever,120.0,None
725729321944506368,2016-04-28 16:52:08+00:00,This is Lola. She's a Butternut Splishnsplash. They are known to be ferocious af. 12/10 would absolutely still pet https://t.co/adQt5a6TZU,12,10,Lola,1610,4806,boxer,120.0,None
725786712245440512,2016-04-28 20:40:11+00:00,Say hello to Lillie. She's a Rutabagan Floofem. Poor pupper ate and then passed out. 11/10 relatable af https://t.co/uIdGqug9rw,11,10,Lillie,1250,3854,chow,110.00000000000001,pupper
725842289046749185,2016-04-29 00:21:01+00:00,This is Colby. He's currently regretting all those times he shook your hand for an extra treat. 12/10 https://t.co/vtVHtKFtBH,12,10,Colby,2424,6534,toy_poodle,120.0,None
726224900189511680,2016-04-30 01:41:23+00:00,I'm getting super heckin frustrated with you all sending in non canines like this ostrich. We only rate dogs... 9/10 https://t.co/Rgbni2Ns8z,9,10,None,1044,4089,standard_poodle,90.0,None
726828223124897792,2016-05-01 17:38:46+00:00,This is Bloop. He's a Phoenician Winnebago. Tongue is just wow. That box is all he has (tragic). 12/10 would caress https://t.co/DWNrPPXgHA,12,10,Bloop,920,3311,miniature_pinscher,120.0,None
727286334147182592,2016-05-02 23:59:09+00:00,I swear to god if we get sent another Blue Madagascan Peacock we'll deactivate. We 👏 Only 👏 Rate 👏 Dogs... 9/10 https://t.co/bbta2Q4URK,9,10,None,747,2834,Chihuahua,90.0,None
727685679342333952,2016-05-04 02:26:00+00:00,This is Cilantro. She's a Fellation Gadzooks. Eyes are super magical af. 12/10 could get lost in https://t.co/yJ26LNuyj5,12,10,Cilantro,577,2738,Border_collie,120.0,None
728015554473250816,2016-05-05 00:16:48+00:00,This is Rueben. He has reached ultimate pupper zen state. 11/10 tranquil af https://t.co/Z167HgtnBi,11,10,Rueben,993,3798,cocker_spaniel,110.00000000000001,pupper
728035342121635841,2016-05-05 01:35:26+00:00,This is all I want in my life. 12/10 for super sleepy pupper https://t.co/4RlLA5ObMh,12,10,all,1516,4170,Shih-Tzu,120.0,pupper
728046963732717569,2016-05-05 02:21:37+00:00,This is Raymond. He controls fountains with his tongue. 11/10 pretty damn magical https://t.co/9aMxSbOaAZ,11,10,Raymond,1086,3952,Newfoundland,110.00000000000001,None
728387165835677696,2016-05-06 00:53:27+00:00,"This is Enchilada (yes, that's her real name). She's a Low-Cruisin Plopflopple. Very rare. Only a few left. 12/10 https://t.co/SiaiTWgsfP",12,10,Enchilada,880,3430,collie,120.0,None
728751179681943552,2016-05-07 00:59:55+00:00,This is Flurpson. He can't believe it's not butter. 10/10 https://t.co/XD3ort1PsE,10,10,Flurpson,618,2553,Saint_Bernard,100.0,None
728760639972315136,2016-05-07 01:37:30+00:00,"When you're way too slow for the ""down low"" portion of a high five. 13/10 https://t.co/Cofwoy7Vpq",13,10,None,1547,4304,Pembroke,130.0,None
729463711119904772,2016-05-09 00:11:16+00:00,Meet Pupcasso. You can't afford his art. 13/10 talented af https://t.co/f2VUpy4WO0,13,10,Pupcasso,2100,5333,German_shepherd,130.0,None
729823566028484608,2016-05-10 00:01:12+00:00,This is Stefan. He's a downright remarkable pup. 13/10 https://t.co/Ebjt6Y4fMh,13,10,Stefan,1128,3664,kelpie,130.0,None
730211855403241472,2016-05-11 01:44:07+00:00,This is Ziva. She doesn't know how her collar works. 11/10 would totally fix for her https://t.co/K7pthJXjWE,11,10,Ziva,960,3509,pug,110.00000000000001,None
730427201120833536,2016-05-11 15:59:50+00:00,This is Crystal. She's flawless. Really wants to be a frat bro. 11/10 who does she even know here? https://t.co/WyqNFvEulG,11,10,Crystal,942,3210,Eskimo_dog,110.00000000000001,None
730924654643314689,2016-05-13 00:56:32+00:00,We only rate dogs. Pls stop sending non-canines like this Bulgarian Eyeless Porch Bear. This is unacceptable... 9/10 https://t.co/2yctWAUZ3Z,9,10,unacceptable,1792,5658,Newfoundland,90.0,None
731285275100512256,2016-05-14 00:49:30+00:00,This is Solomon. He's a Beneroo Cumberflop. 12/10 would hug passionately https://t.co/5phLAnGPTP,12,10,Solomon,904,3226,Pembroke,120.0,None
732005617171337216,2016-05-16 00:31:53+00:00,This is Larry. He has no self control. Tongue still nifty af tho 11/10 https://t.co/ghyT4Ubk1r,11,10,Larry,4886,13718,English_setter,110.00000000000001,None
732375214819057664,2016-05-17 01:00:32+00:00,This is Kyle (pronounced 'Mitch'). He strives to be the best doggo he can be. 11/10 would pat on head approvingly https://t.co/aA2GiTGvlE,11,10,Kyle,2288,7445,golden_retriever,110.00000000000001,doggo
732726085725589504,2016-05-18 00:14:46+00:00,This is Aldrick. He looks wise af. Also exceptionally fluffy. Only two legs tho (unfortunate). 11/10 would still hug https://t.co/QwiCVLPMNL,11,10,Aldrick,801,3298,Pomeranian,110.00000000000001,None
733109485275860992,2016-05-19 01:38:16+00:00,"Like father (doggo), like son (pupper). Both 12/10 https://t.co/pG2inLaOda",12,10,None,15549,49415,golden_retriever,120.0,doggo
733460102733135873,2016-05-20 00:51:30+00:00,This is Hermione. Her face is as old as time. Appears fluffy af tho. 11/10 pretty damn majestic https://t.co/0b41Q4DKCA,11,10,Hermione,1141,3878,chow,110.00000000000001,None
733482008106668032,2016-05-20 02:18:32+00:00,"""Ello this is dog how may I assist"" ...10/10 https://t.co/jeAENpjH7L",10,10,None,855,2885,French_bulldog,100.0,None
733822306246479872,2016-05-21 00:50:46+00:00,This is Moose. He's a Polynesian Floofer. Dapper af. 10/10 would pet diligently https://t.co/mVfqRdppTL,10,10,Moose,932,3392,Lhasa,100.0,floofer
734776360183431168,2016-05-23 16:01:50+00:00,This is Livvie. Someone should tell her it's been 47 years since Woodstock. Magical eyes tho 11/10 would stare into https://t.co/qw07vhVHuO,11,10,Livvie,489,2328,Siberian_husky,110.00000000000001,None
734912297295085568,2016-05-24 01:02:00+00:00,This is Jax. He's a literal fluffball. Sneaky tongue slip. 10/10 would pet nonstop https://t.co/9MGouPwQmK,10,10,Jax,472,2550,Maltese_dog,100.0,None
735137028879360001,2016-05-24 15:55:00+00:00,Meet Buckley. His family &amp; some neighbors came over to watch him perform but he's nervous af. 9/10 u got this pupper https://t.co/5bdCpPlno9,9,10,Buckley,885,2885,Walker_hound,90.0,pupper
735256018284875776,2016-05-24 23:47:49+00:00,This is Kellogg. He accidentally opened the front facing camera. 8/10 get it together doggo https://t.co/MRYv7nDPyS,8,10,Kellogg,803,3074,Staffordshire_bullterrier,80.0,doggo
735635087207878657,2016-05-26 00:54:06+00:00,This is Dakota. He hasn't grow into his skin yet. 11/10 would squeeze softly https://t.co/IvFSlNXpgj,11,10,Dakota,2147,5677,pug,110.00000000000001,None
735648611367784448,2016-05-26 01:47:51+00:00,*faints* 12/10 perfection in pupper form https://t.co/t6TxTwTLEK,12,10,None,1016,3737,Pembroke,120.0,pupper
736225175608430592,2016-05-27 15:58:54+00:00,We only rate dogs. Please stop sending in non-canines like this Alaskan Flop Turtle. This is very frustrating. 10/10 https://t.co/qXteK6Atxc,10,10,very,2551,7503,Labrador_retriever,100.0,None
736736130620620800,2016-05-29 01:49:16+00:00,This is Chadrick. He's gnarly af 13/10 https://t.co/447tyBN0mW,13,10,Chadrick,1545,3892,schipperke,130.0,None
737445876994609152,2016-05-31 00:49:32+00:00,Just wanted to share this super rare Rainbow Floofer in case you guys haven't seen it yet. 13/10 colorful af https://t.co/CaG9MzD3WT,13,10,None,4069,9473,Samoyed,130.0,floofer
737678689543020544,2016-05-31 16:14:39+00:00,We only rate dogs. Pls stop sending in non-canines like this Slovak Car Bunny. It makes my job very difficult. 11/10 https://t.co/VflvQLH2y5,11,10,None,1203,4640,Pembroke,110.00000000000001,None
737800304142471168,2016-06-01 00:17:54+00:00,This is Bella. She's ubering home after a few too many drinks. 10/10 socially conscious af https://t.co/KxkOgq80Xj,10,10,Bella,3179,9291,malamute,100.0,None
737826014890496000,2016-06-01 02:00:04+00:00,This is Remy. He has some long ass ears (probably magical). Also very proud of broken stick. 10/10 such a good boy https://t.co/EZx0YjPjPK,10,10,Remy,1611,4843,vizsla,100.0,None
738156290900254721,2016-06-01 23:52:28+00:00,This is Storkson. He's wet and sad. 10/10 cheer up pup https://t.co/nrzvzPuTvC,10,10,Storkson,587,2291,pug,100.0,None
738184450748633089,2016-06-02 01:44:22+00:00,"For the last time, we only rate dogs. Pls stop sending other animals like this Duck-Billed Platypus. Thank you. 9/10 https://t.co/twxYcPOafl",9,10,None,1109,3984,Bedlington_terrier,90.0,None
738402415918125056,2016-06-02 16:10:29+00:00,"""Don't talk to me or my son ever again"" ...10/10 for both https://t.co/s96OYXZIfK",10,10,None,744,3020,cocker_spaniel,100.0,None
738537504001953792,2016-06-03 01:07:16+00:00,This is Bayley. She fell asleep trying to escape her evil fence enclosure. 11/10 night night puppo https://t.co/AxSiqAKEKu,11,10,Bayley,1401,4709,chow,110.00000000000001,puppo
738885046782832640,2016-06-04 00:08:17+00:00,This is Charles. He's a Nova Scotian Towel Pouncer. Deadly af. Nifty tongue slip. 11/10 would pet with caution https://t.co/EfejX3iRGr,11,10,Charles,1047,3506,American_Staffordshire_terrier,110.00000000000001,None
739238157791694849,2016-06-04 23:31:25+00:00,Here's a doggo blowing bubbles. It's downright legendary. 13/10 would watch on repeat forever (vid by Kent Duryee) https://t.co/YcXgHfp1EC,13,10,None,52917,107281,Eskimo_dog,130.0,doggo
739544079319588864,2016-06-05 19:47:03+00:00,This... is a Tyrannosaurus rex. We only rate dogs. Please only send in dogs. Thank you ...10/10 https://t.co/zxw8d5g94P,10,10,None,19290,36518,Labrador_retriever,100.0,None
739844404073074688,2016-06-06 15:40:26+00:00,This is Simba. He's the grand prize. The trophy is just for participation. 12/10 would pet so damn well https://t.co/4qiuC0lXq5,12,10,Simba,791,3533,toy_poodle,120.0,None
739932936087216128,2016-06-06 21:32:13+00:00,Say hello to Rorie. She's zen af. Just enjoying a treat in the sunlight. 10/10 would immediately trade lives with https://t.co/yctnFptdQ1,10,10,Rorie,988,3764,redbone,100.0,None
739979191639244800,2016-06-07 00:36:02+00:00,This is Nollie. She's waving at you. If you don't wave back you're a monster. She's also portable as hell. 12/10 https://t.co/7AKdkCOlMf,12,10,Nollie,5389,18538,Irish_water_spaniel,120.0,None
740214038584557568,2016-06-07 16:09:13+00:00,This is getting incredibly frustrating. This is a Mexican Golden Beaver. We only rate dogs. Only send dogs ...10/10 https://t.co/0yolOOyD3X,10,10,getting,1791,6196,Chesapeake_Bay_retriever,100.0,None
740359016048689152,2016-06-08 01:45:19+00:00,This is Chase. He's in a predicament. 9/10 help is on the way buddy https://t.co/0HmBk5sSbW,9,10,Chase,798,3051,golden_retriever,90.0,None
740711788199743490,2016-06-09 01:07:06+00:00,Here we are witnessing the touchdown of a pupnado. It's not funny it's actually very deadly. 9/10 might still pet https://t.co/CmLoKMbOHv,9,10,None,865,3152,toy_poodle,90.0,None
740995100998766593,2016-06-09 19:52:53+00:00,This is Leo. He's a vape god. Blows o's for days. Probably drives a Subaru. Definitely owns multiple fedoras. 10/10 https://t.co/nt2x3fHaRJ,10,10,Leo,2478,5839,malamute,100.0,None
741067306818797568,2016-06-10 00:39:48+00:00,This is just downright precious af. 12/10 for both pupper and doggo https://t.co/o5J479bZUC,12,10,just,2818,8873,golden_retriever,120.0,doggo
741303864243200000,2016-06-10 16:19:48+00:00,This is Theodore. He just saw an adult wearing crocs. Did him a frighten. Lost other ear back in nam. 12/10 hero af https://t.co/O4iw9NlLaQ,12,10,Theodore,2927,8142,Chihuahua,120.0,None
741438259667034112,2016-06-11 01:13:51+00:00,This is Tucker. He's still figuring out couches. 9/10 keep your head up pup https://t.co/pXU77HPbJ5,9,10,Tucker,748,3422,Chesapeake_Bay_retriever,90.0,None
741743634094141440,2016-06-11 21:27:17+00:00,Meet Aqua. She's a sandy pupper. Not sure how she feels about being so sandy. Radical tongue slip. 11/10 petable af https://t.co/rYxJ0UQtbE,11,10,Aqua,2505,7557,Labrador_retriever,110.00000000000001,pupper
741793263812808706,2016-06-12 00:44:30+00:00,When your crush won't pay attention to you. Both 10/10 tragic af https://t.co/d3LELGVlqu,10,10,None,1388,4220,kuvasz,100.0,None
742385895052087300,2016-06-13 15:59:24+00:00,This is Phil. That's his comfort stick. He holds onto it whenever he's sad. 11/10 don't be sad Phil https://t.co/ULdPY6CLpq,11,10,Phil,1780,6299,Cardigan,110.00000000000001,None
742423170473463808,2016-06-13 18:27:32+00:00,This is Bell. She likes holding hands. 12/10 would definitely pet with other hand https://t.co/BXIuvkQO9b,12,10,Bell,3428,9114,pug,120.0,None
743210557239623680,2016-06-15 22:36:19+00:00,"Meet Kayla, an underground poker legend. Players lose on purpose hoping she'll let them pet her. 10/10 strategic af https://t.co/EkLku795aO",10,10,Kayla,1239,3561,golden_retriever,100.0,None
743222593470234624,2016-06-15 23:24:09+00:00,This is a very rare Great Alaskan Bush Pupper. Hard to stumble upon without spooking. 12/10 would pet passionately https://t.co/xOBKCdpzaa,12,10,a,1745,5740,kuvasz,120.0,pupper
743253157753532416,2016-06-16 01:25:36+00:00,"This is Kilo. He cannot reach the snackum. Nifty tongue, but not nifty enough. 10/10 maybe one day puppo https://t.co/gSmp31Zrsx",10,10,Kilo,1125,3938,malamute,100.0,puppo
743895849529389061,2016-06-17 19:59:26+00:00,When you're given AUX cord privileges from the back seat and accidentally start blasting an audiobook... both 10/10 https://t.co/gCCrY8P0K9,10,10,None,881,3407,dalmatian,100.0,None
743980027717509120,2016-06-18 01:33:55+00:00,This is Geno. He's a Wrinkled Baklavian Velveeta. Looks sad but that's just the extra skin. 11/10 would smoosh face https://t.co/Kxda28JmQ2,11,10,Geno,1005,3905,bull_mastiff,110.00000000000001,None
744234799360020481,2016-06-18 18:26:18+00:00,Here's a doggo realizing you can stand in a pool. 13/10 enlightened af (vid by Tina Conrad) https://t.co/7wE9LTEXC4,13,10,None,70771,144933,Labrador_retriever,130.0,doggo
744334592493166593,2016-06-19 01:02:50+00:00,This is Blanket. She has overthrown her human. Demands walks like this every hour on the hour. 11/10 so damn fluffy https://t.co/hrJugNHs2Z,11,10,Blanket,1938,6344,Samoyed,110.00000000000001,None
744709971296780288,2016-06-20 01:54:27+00:00,This is Harvey. He's stealthy af. 10/10 would do my best to pet https://t.co/zAzaRT6NnT,10,10,Harvey,1442,5232,Shetland_sheepdog,100.0,None
744971049620602880,2016-06-20 19:11:53+00:00,Say hello to Indie and Jupiter. They're having a stellar day out on the boat. Both 12/10 adorbz af https://t.co/KgSEkrPA3r,12,10,Indie,2451,7314,toy_poodle,120.0,None
744995568523612160,2016-06-20 20:49:19+00:00,This is Abby. She got her face stuck in a glass. Churlish af. 9/10 rookie move puppo https://t.co/2FPb45NXrK,9,10,Abby,569,2752,Old_English_sheepdog,90.0,puppo
745422732645535745,2016-06-22 01:06:43+00:00,We only rate dogs. Pls stop sending in non-canines like this Jamaican Flop Seal. This is very very frustrating. 9/10 https://t.co/nc53zEN0hZ,9,10,very,2208,7953,Labrador_retriever,90.0,None
745789745784041472,2016-06-23 01:25:06+00:00,This is Gus. He didn't win the Powerball. Quite perturbed about it. Still 10/10 would comfort in time of need https://t.co/3wc246LOtu,10,10,Gus,966,3678,Pekinese,100.0,None
746056683365994496,2016-06-23 19:05:49+00:00,This is Arlen and Thumpelina. They are best pals. Cuddly af. 11/10 for both puppers https://t.co/VJgbgIzIHx,11,10,Arlen,742,3328,Shetland_sheepdog,110.00000000000001,None
746131877086527488,2016-06-24 00:04:36+00:00,This is Gustav. He has claimed that plant. It is his now. 10/10 would not try to take his plant away https://t.co/uRI7HBgGJX,10,10,Gustav,2005,6404,chow,100.0,None
746369468511756288,2016-06-24 15:48:42+00:00,This is an Iraqi Speed Kangaroo. It is not a dog. Please only send in dogs. I'm very angry with all of you ...9/10 https://t.co/5qpBTTpgUt,9,10,an,1491,5773,German_shepherd,90.0,None
746507379341139972,2016-06-25 00:56:43+00:00,This is Shiloh. She did not pass the soft mouth egg test. 10/10 would absolutely still pet https://t.co/PlR6hjqvr5,10,10,Shiloh,991,4346,toy_poodle,100.0,None
746726898085036033,2016-06-25 15:29:00+00:00,Meet Abby. She's incredibly distracting. Just wants to help steer. Hazardous af. Still 12/10 would pet while driving https://t.co/gLbLiZtwsp,12,10,Abby,1642,5644,golden_retriever,120.0,None
746872823977771008,2016-06-26 01:08:52+00:00,This is a carrot. We only rate dogs. Please only send in dogs. You all really should know this by now ...11/10 https://t.co/9e48aPrBm2,11,10,a,1953,5584,Pembroke,110.00000000000001,None
747512671126323200,2016-06-27 19:31:23+00:00,Guys pls stop sending actual sharks. It's too dangerous for me and the people taking the photos. Thank you ...10/10 https://t.co/12lICZN2SP,10,10,None,1478,5141,Cardigan,100.0,None
747594051852075008,2016-06-28 00:54:46+00:00,Again w the sharks guys. This week is about dogs ACTING or DRESSING like sharks. NOT actual sharks. Thank u ...11/10 https://t.co/Ie2mWXWjpr,11,10,None,951,3426,basenji,110.00000000000001,None
747600769478692864,2016-06-28 01:21:27+00:00,This is Bookstore and Seaweed. Bookstore is tired and Seaweed is an asshole. 10/10 and 7/10 respectively https://t.co/eUGjGjjFVJ,10,10,Bookstore,523,2171,Chesapeake_Bay_retriever,100.0,None
747816857231626240,2016-06-28 15:40:07+00:00,Viewer discretion is advised. This is a terrible attack in progress. Not even in water (tragic af). 4/10 bad sherk https://t.co/L3U0j14N5R,4,10,a,1061,4506,Pembroke,40.0,None
747844099428986880,2016-06-28 17:28:22+00:00,This is Huxley. He's pumped for #BarkWeek. Even has a hat. Ears are quite magical. 11/10 would remove hat to pat https://t.co/V7h5NMYbYz,11,10,Huxley,677,2632,Pembroke,110.00000000000001,None
747885874273214464,2016-06-28 20:14:22+00:00,This is a mighty rare blue-tailed hammer sherk. Human almost lost a limb trying to take these. Be careful guys. 8/10 https://t.co/TGenMeXreW,8,10,a,882,2727,kuvasz,80.0,None
747933425676525569,2016-06-28 23:23:19+00:00,Pls don't send more sherks. I don't care how seemingly floofy they are. It does me so much frighten. Thank u. 11/10 https://t.co/oQqlOsla4R,11,10,None,2361,6183,Samoyed,110.00000000000001,None
747963614829678593,2016-06-29 01:23:16+00:00,PUPPER NOOOOO BEHIND YOUUU 10/10 pls keep this pupper in your thoughts https://t.co/ZPfeRtOX0Q,10,10,None,1961,5393,kelpie,100.0,pupper
748324050481647620,2016-06-30 01:15:31+00:00,This is Duke. He permanently looks like he just tripped over something. 11/10 https://t.co/1sNtG7GgiO,11,10,Duke,695,3462,Shetland_sheepdog,110.00000000000001,None
748346686624440324,2016-06-30 02:45:28+00:00,"""So... we meat again"" (I'm so sorry for that pun I couldn't resist pls don't unfollow) 10/10 https://t.co/XFBrrqapZa",10,10,None,1124,4863,borzoi,100.0,None
748568946752774144,2016-06-30 17:28:39+00:00,This is Cora. She rings a bell for treats. 12/10 precious af (vid by @skyehellenkamp) https://t.co/uUncaAGH18,12,10,Cora,611,2051,Tibetan_terrier,120.0,None
748575535303884801,2016-06-30 17:54:50+00:00,This is one of the most reckless puppers I've ever seen. How she got a license in the first place is beyond me. 6/10 https://t.co/z5bAdtn9kd,6,10,one,1814,5647,soft-coated_wheaten_terrier,60.0,None
748699167502000129,2016-07-01 02:06:06+00:00,Meet Tripp. He's being eaten by a sherk and doesn't even care. Unfazed af. 11/10 keep doin you Tripp https://t.co/gGxjthmG1c,11,10,Tripp,1460,4420,Pembroke,110.00000000000001,None
748932637671223296,2016-07-01 17:33:49+00:00,Say hello to Divine Doggo. Must be magical af. 13/10 would be an honor to pet https://t.co/BbcABzohKb,13,10,Divine,2064,5414,borzoi,130.0,doggo
748977405889503236,2016-07-01 20:31:43+00:00,What jokester sent in a pic without a dog in it? This is not @rock_rates. This is @dog_rates. Thank you ...10/10 https://t.co/nDPaYHrtNX,10,10,not,3138,10041,German_short-haired_pointer,100.0,None
749036806121881602,2016-07-02 00:27:45+00:00,This is Dietrich. He hops at random. Other doggos don't understand him. It upsets him greatly. 8/10 would comfort https://t.co/U8cSRz8wzC,8,10,Dietrich,731,2886,Samoyed,80.0,None
749317047558017024,2016-07-02 19:01:20+00:00,This is Blu. He's a wild bush Floofer. I wish anything made me as happy as bushes make Blu. 12/10 would frolic with https://t.co/HHUAnBb6QB,12,10,Blu,2051,5106,wire-haired_fox_terrier,120.0,floofer
749395845976588288,2016-07-03 00:14:27+00:00,This is George. He just remembered that bees are dying globally at an alarming rate. Scary stuff George. 10/10 https://t.co/lznl6QGkYc,10,10,George,3158,7972,Pomeranian,100.0,None
749403093750648834,2016-07-03 00:43:15+00:00,Duuun dun... duuun dun... dunn  dun. dunn dun. dun dun dun dun dun dun dun dun dun dun dun dun dun dun dun. 10/10 https://t.co/9qdJ2Q1Cwx,10,10,None,493,2443,Chesapeake_Bay_retriever,100.0,None
749774190421639168,2016-07-04 01:17:51+00:00,This is Lucy. She's a Benebop Cumberplop. 12/10 would hold against my face https://t.co/4yXa801fgl,12,10,Lucy,1213,4358,Pekinese,120.0,None
749996283729883136,2016-07-04 16:00:22+00:00,This is Bo. He emanates happiness. 12/10 I could cut the freedom with a knife https://t.co/c7LNFt39eR,12,10,Bo,758,2838,Old_English_sheepdog,120.0,None
750026558547456000,2016-07-04 18:00:41+00:00,Meet Jax &amp; Jil. Jil is yelling the pledge of allegiance. If u cant take the freedom get out the kitchen Jax. 10/10s https://t.co/jrg29NDNhI,10,10,Jax,721,2536,standard_poodle,100.0,None
750041628174217216,2016-07-04 19:00:33+00:00,This is Beau. He's trying to keep his daddy from packing to leave for Annual Training. 13/10 and now I'm crying https://t.co/7JeDfQvzzI,13,10,Beau,568,2971,Labrador_retriever,130.0,None
750056684286914561,2016-07-04 20:00:23+00:00,This is Jameson. He had a few too many in the name of freedom. I can't not respect that. 11/10 'Merica https://t.co/8zQvXM6pG5,11,10,Jameson,822,2961,Saluki,110.00000000000001,None
750086836815486976,2016-07-04 22:00:12+00:00,This is Spanky. He was a member of the 2002 USA Winter Olympic speed skating team. Accomplished af. 12/10 https://t.co/7tlZPrePXd,12,10,Spanky,493,2028,pug,120.0,None
750132105863102464,2016-07-05 01:00:05+00:00,This is Stewie. He will roundhouse kick anyone who questions his independence. 11/10 free af https://t.co/dDx2gKefYo,11,10,Stewie,1184,3377,toy_poodle,110.00000000000001,None
750147208377409536,2016-07-05 02:00:06+00:00,"And finally, happy 4th of July from the squad 🇺🇸 13/10 for all https://t.co/Mr8Lr3iOUe",13,10,None,877,2916,pug,130.0,None
750383411068534784,2016-07-05 17:38:41+00:00,This is Zoe. She was trying to stealthily take a picture of you but you just noticed. 9/10 not so sneaky pupper https://t.co/FfH3o88Vta,9,10,Zoe,1042,4271,Border_collie,90.0,pupper
750429297815552001,2016-07-05 20:41:01+00:00,This is Arnie. He's a Nova Scotian Fridge Floof. Rare af. 12/10 https://t.co/lprdOylVpS,12,10,Arnie,3923,12314,golden_retriever,120.0,None
750719632563142656,2016-07-06 15:54:42+00:00,This is Meyer. He has to hold somebody's hand during car rides. He's also wearing a seatbelt. 12/10 responsible af https://t.co/WS6BoApYyL,12,10,Meyer,4594,12277,Pembroke,120.0,None
751132876104687617,2016-07-07 19:16:47+00:00,This is Cooper. He's just so damn happy. 10/10 what's your secret puppo? https://t.co/yToDwVXEpA,10,10,Cooper,1188,4734,Labrador_retriever,100.0,puppo
751251247299190784,2016-07-08 03:07:09+00:00,This is Gilbert. He's being chased by a battalion of miniature floof cows. 10/10 we all believe in you Gilbert https://t.co/wayKZkDRTG,10,10,Gilbert,5398,11750,Walker_hound,100.0,None
751456908746354688,2016-07-08 16:44:23+00:00,Here's a pupper that's very hungry but too lazy to get up and eat. 12/10 (vid by @RealDavidCortes) https://t.co/lsVAMBq6ex,12,10,None,925,3016,golden_retriever,120.0,pupper
