tweet_id,timestamp,text,rating_numerator,rating_denominator,name,retweet_count,favorite_count,dog_breed,rating,dog_stage
666020888022790149,2015-11-15 22:32:08+00:00,Here we have a Japanese Irish Setter. Lost eye in Vietnam (?). Big fan of relaxing on stair. 8/10 would pet https://t.co/BLDqew2Ijj,8,10,None,423,2292,Welsh_springer_spaniel,80.0,None
666029285002620928,2015-11-15 23:05:30+00:00,This is a western brown Mitsubishi terrier. Upset about leaf. Actually 2 dogs here. 7/10 would walk the shit out of https://t.co/r7mOb2m0UI,7,10,a,39,112,redbone,70.0,None
666033412701032449,2015-11-15 23:21:54+00:00,Here is a very happy pup. Big fan of well-maintained decks. Just look at that tongue. 9/10 would cuddle af https://t.co/y671yMhoiR,9,10,a,36,100,German_shepherd,90.0,None
666044226329800704,2015-11-16 00:04:52+00:00,This is a purebred Piers Morgan. Loves to Netflix and chill. Always looks like he forgot to unplug the iron. 6/10 https://t.co/DWnyCjf2mx,6,10,a,115,247,Rhodesian_ridgeback,60.0,None
666049248165822465,2015-11-16 00:24:50+00:00,Here we have a 1949 1st generation vulpix. Enjoys sweat tea and Fox News. Cannot be phased. 5/10 https://t.co/4B7cOc1EDq,5,10,None,37,89,miniature_pinscher,50.0,None
666050758794694657,2015-11-16 00:30:50+00:00,This is a truly beautiful English Wilson Staff retriever. Has a nice phone. Privileged. 10/10 would trade lives with https://t.co/fvIbQfHjIe,10,10,a,50,115,Bernese_mountain_dog,100.0,None
666055525042405380,2015-11-16 00:49:46+00:00,Here is a Siberian heavily armored polar bear mix. Strong owner. 10/10 I would do unspeakable things to pet this dog https://t.co/rdivxLiqEt,10,10,a,196,367,chow,100.0,None
666057090499244032,2015-11-16 00:55:59+00:00,My oh my. This is a rare blond Canadian terrier on wheels. Only $8.98. Rather docile. 9/10 very rare https://t.co/yWBqbrzy8O,9,10,a,112,247,golden_retriever,90.0,None
666058600524156928,2015-11-16 01:01:59+00:00,Here is the Rand Paul of retrievers folks! He's probably good at poker. Can drink beer (lol rad). 8/10 good dog https://t.co/pYAJkAe76p,8,10,the,47,99,miniature_poodle,80.0,None
666063827256086533,2015-11-16 01:22:45+00:00,This is the happiest dog you will ever see. Very committed owner. Nice couch. 10/10 https://t.co/RhUEAloehK,10,10,the,180,400,golden_retriever,100.0,None
666071193221509120,2015-11-16 01:52:02+00:00,Here we have a northern speckled Rhododendron. Much sass. Gives 0 fucks. Good tongue. 9/10 would caress sensually https://t.co/ZoL8kq2XFx,9,10,None,51,127,Gordon_setter,90.0,None
666073100786774016,2015-11-16 01:59:36+00:00,Let's hope this flight isn't Malaysian (lol). What a dog! Almost completely camouflaged. 10/10 I trust this pilot https://t.co/Yk6GHE9tOY,10,10,None,132,274,Walker_hound,100.0,None
666082916733198337,2015-11-16 02:38:37+00:00,Here we have a well-established sunblockerspaniel. Lost his other flip-flop. 6/10 not very waterproof https://t.co/3RU6x0vHB7,6,10,None,37,93,pug,60.0,None
666094000022159362,2015-11-16 03:22:39+00:00,This appears to be a Mongolian Presbyterian mix. Very tired. Tongue slip confirmed. 9/10 would lie down with https://t.co/mnioXo3IfP,9,10,None,63,143,bloodhound,90.0,None
666099513787052032,2015-11-16 03:44:34+00:00,Can stand on stump for what seems like a while. Built that birdhouse? Impressive. Made friends with a squirrel. 8/10 https://t.co/Ri4nMTLq5C,8,10,None,53,134,Lhasa,80.0,None
666102155909144576,2015-11-16 03:55:04+00:00,Oh my. Here you are seeing an Adobe Setter giving birth to twins!!! The world is an amazing place. 11/10 https://t.co/11LvqN4WLq,11,10,None,11,66,English_setter,110.00000000000001,None
666273097616637952,2015-11-16 15:14:19+00:00,Can take selfies 11/10 https://t.co/ws2AMaNwPW,11,10,None,68,152,Italian_greyhound,110.00000000000001,None
666287406224695296,2015-11-16 16:11:11+00:00,This is an Albanian 3 1/2 legged  Episcopalian. Loves well-polished hardwood flooring. Penis on the collar. 9/10 https://t.co/d9NcXFKwLv,1,2,an,57,123,Maltese_dog,50.0,None
666337882303524864,2015-11-16 19:31:45+00:00,This is an extremely rare horned Parthenon. Not amused. Wears shoes. Overall very nice. 9/10 would pet aggressively https://t.co/QpRjllzWAL,9,10,an,79,168,groenendael,90.0,None
666345417576210432,2015-11-16 20:01:42+00:00,Look at this jokester thinking seat belt laws don't apply to him. Great tongue tho 10/10 https://t.co/VFKG1vxGjB,10,10,None,124,244,golden_retriever,100.0,None
666353288456101888,2015-11-16 20:32:58+00:00,Here we have a mixed Asiago from the Galápagos Islands. Only one ear working. Big fan of marijuana carpet. 8/10 https://t.co/tltQ5w9aUO,8,10,None,58,179,malamute,80.0,None
666373753744588802,2015-11-16 21:54:18+00:00,Those are sunglasses and a jean jacket. 11/10 dog cool af https://t.co/uHXrPkUEyl,11,10,None,73,163,soft-coated_wheaten_terrier,110.00000000000001,None
666396247373291520,2015-11-16 23:23:41+00:00,Oh goodness. A super rare northeast Qdoba kangaroo mix. Massive feet. No pouch (disappointing). Seems alert. 9/10 https://t.co/Dc7b0E8qFE,9,10,None,69,147,Chihuahua,90.0,None
666407126856765440,2015-11-17 00:06:54+00:00,This is a southern Vesuvius bumblegruff. Can drive a truck (wow). Made friends with 5 other nifty dogs (neat). 7/10 https://t.co/LopTBkKa8h,7,10,a,30,93,black-and-tan_coonhound,70.0,None
666418789513326592,2015-11-17 00:53:15+00:00,This is Walter. He is an Alaskan Terrapin. Loves outdated bandanas. One ear still working. Cool house plant. 10/10 https://t.co/qXpcwENTvn,10,10,Walter,39,107,toy_terrier,100.0,None
666421158376562688,2015-11-17 01:02:40+00:00,*internally screaming* 12/10 https://t.co/YMcrXC2Y6R,12,10,None,91,273,Blenheim_spaniel,120.0,None
666428276349472768,2015-11-17 01:30:57+00:00,Here we have an Austrian Pulitzer. Collectors edition. Levitates (?). 7/10 would garden with https://t.co/NMQq6HIglK,7,10,None,67,139,Pembroke,70.0,None
666435652385423360,2015-11-17 02:00:15+00:00,"""Can you behave? You're ruining my wedding day""
DOG: idgaf this flashlight tastes good as hell

10/10 https://t.co/GlFZPzqcEU",10,10,None,42,138,Chesapeake_Bay_retriever,100.0,None
666437273139982337,2015-11-17 02:06:42+00:00,Here we see a lone northeastern Cumberbatch. Half ladybug. Only builds with bricks. Very confident with body. 7/10 https://t.co/7LtjBS0GPK,7,10,None,40,106,Chihuahua,70.0,None
666447344410484738,2015-11-17 02:46:43+00:00,This is Scout. She is a black Downton Abbey. Isn't afraid to get dirty. 9/10 nothing bad to say https://t.co/kH60oka1HW,9,10,Scout,19,90,curly-coated_retriever,90.0,None
666454714377183233,2015-11-17 03:16:00+00:00,I'll name the dogs from now on. This is Kreggory. He does parkour. 10/10 https://t.co/uPqPeXAcua,10,10,Kreggory,180,448,dalmatian,100.0,None
666644823164719104,2015-11-17 15:51:26+00:00,This is Jimothy. He is a Botwanian Gouda. Can write (impressive). Very erect tail. Still looking for hoco date. 9/10 https://t.co/LEkZjZxESQ,9,10,Jimothy,70,208,Ibizan_hound,90.0,None
666649482315059201,2015-11-17 16:09:56+00:00,Cool dog. Enjoys couch. Low monotone bark. Very nice kicks. Pisses milk (must be rare). Can't go down stairs. 4/10 https://t.co/vXMKrJC81s,4,10,None,524,993,Border_collie,40.0,None
666691418707132416,2015-11-17 18:56:35+00:00,This is Christoper. He is a spotted Penne. Can easily navigate stairs. 8/10 https://t.co/bg4TqvvkuF,8,10,Christoper,42,161,German_shepherd,80.0,None
666701168228331520,2015-11-17 19:35:19+00:00,This is a golden Buckminsterfullerene named Johm. Drives trucks. Lumberjack (?). Enjoys wall. 8/10 would hug softly https://t.co/uQbZJM2DQB,8,10,a,182,371,Labrador_retriever,80.0,None
666739327293083650,2015-11-17 22:06:57+00:00,This is Lugan. He is a Bohemian Rhapsody. Very confused dog. Thinks his name is Rocky. Not amused by the snows 10/10 https://t.co/tI3uFLDHBI,10,10,Lugan,60,209,miniature_poodle,100.0,None
666776908487630848,2015-11-18 00:36:17+00:00,This is Josep. He is a Rye Manganese mix. Can drive w eyes closed. Very irresponsible. Menace on the roadways. 5/10 https://t.co/XNGeDwrtYH,5,10,Josep,150,305,Chihuahua,50.0,None
666781792255496192,2015-11-18 00:55:42+00:00,This is a purebred Bacardi named Octaviath. Can shoot spaghetti out of mouth. 10/10 https://t.co/uEvsGLOFHa,10,10,a,168,327,Italian_greyhound,100.0,None
666817836334096384,2015-11-18 03:18:55+00:00,This is Jeph. He is a German Boston Shuttlecock. Enjoys couch. Lost body during French Revolution. True hero 9/10 https://t.co/8whlkYw3mO,9,10,Jeph,212,444,miniature_schnauzer,90.0,None
666826780179869698,2015-11-18 03:54:28+00:00,12/10 simply brilliant pup https://t.co/V6ZzG45zzG,12,10,None,79,220,Maltese_dog,120.0,None
666835007768551424,2015-11-18 04:27:09+00:00,These are Peruvian Feldspars. Their names are Cupit and Prencer. Both resemble Rand Paul. Sick outfits 10/10 &amp; 10/10 https://t.co/ZnEMHBsAs1,10,10,None,66,185,Airedale,100.0,None
667044094246576128,2015-11-18 18:17:59+00:00,12/10 gimme now https://t.co/QZAnwgnOMB,12,10,None,43,163,golden_retriever,120.0,None
667062181243039745,2015-11-18 19:29:52+00:00,This is Keet. He is a Floridian Amukamara. Absolutely epic propeller hat. Pristine tongue. Nice plaid. 10/10 https://t.co/tz1lpuvXLA,10,10,Keet,45,192,Chesapeake_Bay_retriever,100.0,None
667073648344346624,2015-11-18 20:15:26+00:00,Here is Dave. He is actually just a skinny legged seal. Happy birthday Dave. 10/10 https://t.co/DPSamreuRq,10,10,Dave,104,351,Chihuahua,100.0,None
667090893657276420,2015-11-18 21:23:57+00:00,This is Clybe. He is an Anemone Valdez. One ear works. Can look in 2 different directions at once. Tongue slip. 7/10 https://t.co/Ks0jZtdIrr,7,10,Clybe,106,287,Chihuahua,70.0,None
667119796878725120,2015-11-18 23:18:48+00:00,This is Gabe. He is a southern Baklava. Gabe has always wanted to fit in with the other bananas. 10/10 fabulous https://t.co/3LZrJzg3BJ,10,10,Gabe,106,286,Pembroke,100.0,None
667138269671505920,2015-11-19 00:32:12+00:00,Extremely intelligent dog here. Has learned to walk like human. Even has his own dog. Very impressive 10/10 https://t.co/0DvHAMdA4V,10,10,None,1874,4017,West_Highland_white_terrier,100.0,None
667152164079423490,2015-11-19 01:27:25+00:00,This is Pipsy. He is a fluffball. Enjoys traveling the sea &amp; getting tangled in leash. 12/10 I would kill for Pipsy https://t.co/h9R0EwKd9X,12,10,Pipsy,14624,42313,toy_poodle,120.0,None
667160273090932737,2015-11-19 01:59:39+00:00,This is Bradlay. He is a Ronaldinho Matsuyama mix. Can also mountain bike (wow). Loves that blue light lime. 11/10 https://t.co/DKhgkMx4N1,11,10,Bradlay,50,219,golden_retriever,110.00000000000001,None
667165590075940865,2015-11-19 02:20:46+00:00,This is Churlie. AKA Fetty Woof. Lost eye saving a school bus full of toddlers from a tsunami. Great guy. 10/10 https://t.co/li2XYBVuAY,10,10,Churlie,972,2380,miniature_pinscher,100.0,None
667171260800061440,2015-11-19 02:43:18+00:00,Say hello to Kenneth. He likes Reese's Puffs. 10/10 https://t.co/6RHNRsByOY,10,10,Kenneth,72,186,giant_schnauzer,100.0,None
667174963120574464,2015-11-19 02:58:01+00:00,"This is Clarence. His face says he doesn't want to be a donkey, but his tail is super pumped about it. 9/10 https://t.co/fGDWgukcBs",9,10,Clarence,70,218,toy_poodle,90.0,None
667176164155375616,2015-11-19 03:02:47+00:00,These are strange dogs. All have toupees. Long neck for dogs. In a shed of sorts? Work in groups? 4/10 still petable https://t.co/PZxSarAfSN,4,10,None,388,527,soft-coated_wheaten_terrier,40.0,None
667177989038297088,2015-11-19 03:10:02+00:00,This is a Dasani Kingfisher from Maine. His name is Daryl. Daryl doesn't like being swallowed by a panda. 8/10 https://t.co/jpaeu6LNmW,8,10,a,48,166,vizsla,80.0,None
667182792070062081,2015-11-19 03:29:07+00:00,This is Timison. He just told an awful joke but is still hanging on to the hope that you'll laugh with him. 10/10 https://t.co/s2yYuHabWl,10,10,Timison,5278,12549,golden_retriever,100.0,None
667192066997374976,2015-11-19 04:05:59+00:00,*takes several long deep breaths* omg omg oMG OMG OMG OMGSJYBSNDUYWJO 12/10 https://t.co/QCugm5ydl6,12,10,None,86,332,Rottweiler,120.0,None
667200525029539841,2015-11-19 04:39:35+00:00,This is Joshwa. He is a fuckboy supreme. He clearly relies on owner but doesn't respect them. Dreamy eyes tho 11/10 https://t.co/60xYFRATPZ,11,10,Joshwa,228,546,Siberian_husky,110.00000000000001,None
667211855547486208,2015-11-19 05:24:37+00:00,This is Genevieve. She is a golden retriever cocktail mix. Comfortable close to wall. Shows no emotions. 9/10 https://t.co/azEoGqVonH,9,10,Genevieve,210,425,golden_retriever,90.0,None
667393430834667520,2015-11-19 17:26:08+00:00,This is Fwed. He is a Canadian Asian Taylormade. Was having a blast until pink spiky football attacked. 8/10 https://t.co/A37eGLz5WS,8,10,Fwed,50,168,papillon,80.0,None
667405339315146752,2015-11-19 18:13:27+00:00,This is Biden. Biden just tripped... 7/10 https://t.co/3Fm9PwLju1,7,10,Biden,197,411,Saint_Bernard,70.0,None
667435689202614272,2015-11-19 20:14:03+00:00,Ermergerd 12/10 https://t.co/PQni2sjPsm,12,10,None,76,266,Rottweiler,120.0,None
667453023279554560,2015-11-19 21:22:56+00:00,Meet Cupcake. I would do unspeakable things for Cupcake. 11/10 https://t.co/6uLCWR9Efa,11,10,Cupcake,74,279,Labrador_retriever,110.00000000000001,None
667455448082227200,2015-11-19 21:32:34+00:00,This is Reese and Twips. Reese protects Twips. Both think they're too good for seat belts. Simply reckless. 7/10s https://t.co/uLzRi1drVK,7,10,Reese,53,171,Tibetan_terrier,70.0,None
667470559035432960,2015-11-19 22:32:36+00:00,This is a northern Wahoo named Kohl. He runs this town. Chases tumbleweeds. Draws gun wicked fast. 11/10 legendary https://t.co/J4vn2rOYFk,11,10,a,85,225,toy_poodle,110.00000000000001,None
667491009379606528,2015-11-19 23:53:52+00:00,Two dogs in this one. Both are rare Jujitsu Pythagoreans. One slightly whiter than other. Long legs. 7/10 and 8/10 https://t.co/ITxxcc4v9y,7,10,None,190,459,borzoi,70.0,None
667495797102141441,2015-11-20 00:12:54+00:00,This is Philippe from Soviet Russia. Commanding leader. Misplaced other boot. Hung flag himself. 9/10 charismatic af https://t.co/5NhPV8E45i,9,10,Philippe,231,458,Chihuahua,90.0,None
667502640335572993,2015-11-20 00:40:05+00:00,Say hello to Hall and Oates. Oates is winking and Hall is contemplating the artistic entropy of the universe. 11/10s https://t.co/n5Wtb5Hvsl,11,10,Hall,194,485,Labrador_retriever,110.00000000000001,None
667509364010450944,2015-11-20 01:06:48+00:00,This a Norwegian Pewterschmidt named Tickles. Ears for days. 12/10 I care deeply for Tickles https://t.co/0aDF62KVP7,12,10,None,1867,6071,beagle,120.0,None
667524857454854144,2015-11-20 02:08:22+00:00,Another topnotch dog. His name is Big Jumpy Rat. Massive ass feet. Superior tail. Jumps high af. 12/10 great pup https://t.co/seESNzgsdm,12,10,None,968,1507,Chesapeake_Bay_retriever,120.0,None
667530908589760512,2015-11-20 02:32:25+00:00,"Meet Naphaniel. He doesn't necessarily enjoy his day job, but he's damn good at it. 10/10 https://t.co/xoRWyQTcmy",10,10,Naphaniel,206,412,golden_retriever,100.0,None
667534815156183040,2015-11-20 02:47:56+00:00,"This is Frank (pronounced ""Fronq""). Too many boxing gloves, not enough passion. Frank is a lover not a fighter. 8/10 https://t.co/CpPxD28IpV",8,10,Frank,446,719,Pembroke,80.0,None
667538891197542400,2015-11-20 03:04:08+00:00,"This is a southwest Coriander named Klint. Hat looks expensive. Still on house arrest :(
9/10 https://t.co/IQTOMqDUIe",9,10,a,58,176,Yorkshire_terrier,90.0,None
667544320556335104,2015-11-20 03:25:43+00:00,"This is Kial. Kial is either wearing a cape, which would be rad, or flashing us, which would be rude. 10/10 or 4/10 https://t.co/8zcwIoiuqR",10,10,Kial,459,762,Pomeranian,100.0,None
667546741521195010,2015-11-20 03:35:20+00:00,Here is George. George took a selfie of his new man bun and that is downright epic. (Also looks like Rand Paul) 9/10 https://t.co/afRtVsoIIb,9,10,George,107,303,toy_poodle,90.0,None
667550904950915073,2015-11-20 03:51:52+00:00,"RT @dogratingrating: Exceptional talent. Original humor. Cutting edge, Nova Scotian comedian. 12/10 https://t.co/uarnTjBeVA",12,10,None,29,0,collie,120.0,None
667728196545200128,2015-11-20 15:36:22+00:00,Meet Olive. He comes to spot by tree to reminisce of simpler times and truly admire his place in the universe. 11/10 https://t.co/LwrCwlWwPB,11,10,Olive,127,325,kuvasz,110.00000000000001,None
667773195014021121,2015-11-20 18:35:10+00:00,This is a rare Hungarian Pinot named Jessiga. She is either mid-stroke or got stuck in the washing machine. 8/10 https://t.co/ZU0i0KJyqD,8,10,a,44,204,West_Highland_white_terrier,80.0,None
667793409583771648,2015-11-20 19:55:30+00:00,Dogs only please. Small cows and other non canines will not be tolerated. Sick tattoos tho 8/10 https://t.co/s1z7mX4c9O,8,10,None,286,609,dalmatian,80.0,None
667801013445750784,2015-11-20 20:25:43+00:00,OMIGOD 12/10 https://t.co/SVMF4Frf1w,12,10,None,82,283,flat-coated_retriever,120.0,None
667806454573760512,2015-11-20 20:47:20+00:00,This is Filup. He is overcome with joy after finally meeting his father. 10/10 https://t.co/TBmDJXJB75,10,10,Filup,417,931,Brabancon_griffon,100.0,None
667832474953625600,2015-11-20 22:30:44+00:00,"THE EYES 12/10

I'm sorry. These are supposed to be funny but your dogs are too adorable https://t.co/z1xPTgVLc7",12,10,None,55,255,miniature_pinscher,120.0,None
667861340749471744,2015-11-21 00:25:26+00:00,This is a Shotokon Macadamia mix named Cheryl. Sophisticated af. Looks like a disappointed librarian. Shh (lol) 9/10 https://t.co/J4GnJ5Swba,9,10,a,69,221,malamute,90.0,None
667878741721415682,2015-11-21 01:34:35+00:00,This is Tedrick. He lives on the edge. Needs someone to hit the gas tho. Other than that he's a baller. 10&amp;2/10 https://t.co/LvP1TTYSCN,2,10,Tedrick,101,349,schipperke,20.0,None
667885044254572545,2015-11-21 01:59:37+00:00,Meet Stu. Stu has stacks on stacks and an eye made of pure gold. 10/10 pay for my tuition pls https://t.co/7rkYZQdKEd,10,10,Stu,400,730,malamute,100.0,None
667886921285246976,2015-11-21 02:07:05+00:00,This is Erik. He's fucken massive. But also kind. Let's people hug him for free. Looks soft. 11/10 I would hug Erik https://t.co/MT7Q4aDQS1,11,10,Erik,908,1648,Pomeranian,110.00000000000001,None
667902449697558528,2015-11-21 03:08:47+00:00,This is Cleopatricia. She is a northern Paperback Maple. Set up hammock somehow. 9/10 would chill in hammock with https://t.co/sJeHdGUt0W,9,10,Cleopatricia,334,759,Norwegian_elkhound,90.0,None
667924896115245057,2015-11-21 04:37:59+00:00,This is Jiminy. He has always wanted to be a cheerleader. Can jump high enough to get on other dog. Go Jiminy. 9/10 https://t.co/fW6kIPFGD2,9,10,Jiminy,95,264,Labrador_retriever,90.0,None
668113020489474048,2015-11-21 17:05:31+00:00,This is Alfie. He's that one hypocritical gym teacher who made you run laps. Great posture. Cool bench. 6/10 https://t.co/GCJzm3YsfX,6,10,Alfie,208,586,Pembroke,60.0,None
668171859951755264,2015-11-21 20:59:20+00:00,This is a Trans Siberian Kellogg named Alfonso. Huge ass eyeballs. Actually Dobby from Harry Potter. 7/10 https://t.co/XpseHBlAAb,7,10,a,162,425,Chihuahua,70.0,None
668190681446379520,2015-11-21 22:14:07+00:00,This is Skittles. I would kidnap Skittles. Pink dog in back hasn't moved in days. 12/10 https://t.co/2wm0POA9N2,12,10,Skittles,171,577,Blenheim_spaniel,120.0,None
668204964695683073,2015-11-21 23:10:52+00:00,This is Ron. Ron's currently experiencing a brain freeze. Damn it Ron. 8/10 https://t.co/4ilfcR5SlK,8,10,Ron,173,489,Labrador_retriever,80.0,None
668221241640230912,2015-11-22 00:15:33+00:00,These two dogs are Bo &amp; Smittens. Smittens is trying out a new deodorant and wanted Bo to smell it. 10/10 true pals https://t.co/4pw1QQ6udh,10,10,None,169,452,chow,100.0,None
668237644992782336,2015-11-22 01:20:44+00:00,This is Torque. He served his nickel. Better not owe Torque money. Torque will find u. 10/10 cause I'm scared of him https://t.co/TnSRDqYO5i,10,10,Torque,2427,5454,chow,100.0,None
668248472370458624,2015-11-22 02:03:45+00:00,Say hello to Bisquick. He is a Brown Douglass Fir terrier. Very inbred. Looks terrified. 8/10 still cute tho https://t.co/1XYRh8N00K,8,10,Bisquick,408,843,Chihuahua,80.0,None
668256321989451776,2015-11-22 02:34:57+00:00,This is Jareld. Jareld rules these waters. Ladies and Gentleman... 13/10. This dog is utterly fucking spectacular. https://t.co/L6qAEV5PAd,13,10,Jareld,518,1154,Pembroke,130.0,None
668268907921326080,2015-11-22 03:24:58+00:00,Here we have an Azerbaijani Buttermilk named Guss. He sees a demon baby Hitler behind his owner. 10/10 stays alert https://t.co/aeZykWwiJN,10,10,None,206,485,Pembroke,100.0,None
668274247790391296,2015-11-22 03:46:11+00:00,Meet Sophie. Her son just got in the car to leave for college. Very touching. Perfect dramatic sunlight. 10/10 yaass https://t.co/3j9kZRcpVB,10,10,Sophie,198,722,soft-coated_wheaten_terrier,100.0,None
668286279830867968,2015-11-22 04:33:59+00:00,Meet Rusty. Rusty's dreaming of a world where Twitter never got rid of favorites. Looks like a happy world. 11/10 https://t.co/C8U6cxI1Jc,11,10,Rusty,118,436,golden_retriever,110.00000000000001,None
668297328638447616,2015-11-22 05:17:54+00:00,2 rare dogs. They waddle (v inefficient). Sometimes slide on bellies. Right one wants to be aircraft Marshall. 9/10s https://t.co/P8bivfp5sU,9,10,None,255,556,Eskimo_dog,90.0,None
668480044826800133,2015-11-22 17:23:57+00:00,Say hello to DayZ. She is definitely stuck on that stair. Just looking for someone to help her. 11/10 I would help https://t.co/be3zMW0Qj5,11,10,DayZ,127,397,pug,110.00000000000001,None
668484198282485761,2015-11-22 17:40:27+00:00,Good teamwork between these dogs. One is on lookout while other eats. Long necks. Nice big house. 9/10s good pups https://t.co/uXgmECGYEB,9,10,None,207,372,standard_poodle,90.0,None
668496999348633600,2015-11-22 18:31:19+00:00,This is Jo. Jo is a Swedish Queso. Tongue bigger than face. Tiny lil legs. Still no seatbelt. Simply careless. 8/10 https://t.co/Edy7B5vOp2,8,10,Jo,114,359,Staffordshire_bullterrier,80.0,None
668507509523615744,2015-11-22 19:13:05+00:00,This is a Birmingham Quagmire named Chuk. Loves to relax and watch the game while sippin on that iced mocha. 10/10 https://t.co/HvNg9JWxFt,10,10,a,87,279,basenji,100.0,None
668528771708952576,2015-11-22 20:37:34+00:00,This is Gòrdón. He enjoys his razberrita by pool. Not a care in the world. 12/10 this dog has a better life than me https://t.co/zpdBQCcYgW,12,10,Gòrdón,189,404,Labrador_retriever,120.0,None
668537837512433665,2015-11-22 21:13:35+00:00,This is Spark. He's nervous. Other dog hasn't moved in a while. Won't come when called. Doesn't fetch well 8/10&amp;1/10 https://t.co/stEodX9Aba,8,10,Spark,61,226,Lakeland_terrier,80.0,None
668542336805281792,2015-11-22 21:31:28+00:00,There's a lot going on here but in my honest opinion every dog pictured is pretty fabulous. 10/10 for all. Good dogs https://t.co/VvYVbsi6c3,10,10,None,182,403,American_Staffordshire_terrier,100.0,None
668567822092664832,2015-11-22 23:12:44+00:00,This is Marvin. He can tie a bow tie better than me. 11/10 https://t.co/81kzPgqjQ3,11,10,Marvin,46,206,Shih-Tzu,110.00000000000001,None
668627278264475648,2015-11-23 03:09:00+00:00,This is Timofy. He's a pilot for Southwest. It's Christmas morning &amp; everyone has gotten kickass gifts but him. 9/10 https://t.co/3FuNbzyPwo,9,10,Timofy,97,281,French_bulldog,90.0,None
668631377374486528,2015-11-23 03:25:17+00:00,Meet Zeek. He is a grey Cumulonimbus. Zeek is hungry. Someone should feed Zeek asap. 5/10 absolutely terrifying https://t.co/fvVNScw8VH,5,10,Zeek,280,618,miniature_schnauzer,50.0,None
668633411083464705,2015-11-23 03:33:22+00:00,This is Churlie. He likes bagels. 10/10 https://t.co/k8P6FZlzAG,10,10,Churlie,1384,2469,Pekinese,100.0,None
668636665813057536,2015-11-23 03:46:18+00:00,This is an Irish Rigatoni terrier named Berta. Completely made of rope. No eyes. Quite large. Loves to dance. 10/10 https://t.co/EM5fDykrJg,10,10,an,435,922,komondor,100.0,None
668655139528511488,2015-11-23 04:59:42+00:00,Say hello to Winifred. He is a Papyrus Hydrangea mix. Can tie shoes. 11/10 inspiring pup https://t.co/mwnBN6ZkPt,11,10,Winifred,190,474,beagle,110.00000000000001,None
668779399630725120,2015-11-23 13:13:28+00:00,This is Kevon. He is not physically or mentally prepared to start his Monday. 10/10 totes relatable https://t.co/YVAJgWHzPW,10,10,Kevon,325,628,Chesapeake_Bay_retriever,100.0,None
668815180734689280,2015-11-23 15:35:39+00:00,This is a wild Toblerone from Papua New Guinea. Mouth always open. Addicted to hay. Acts blind. 7/10 handsome dog https://t.co/IGmVbz07tZ,7,10,a,227,494,redbone,70.0,None
668826086256599040,2015-11-23 16:18:59+00:00,This is Banditt. He is a brown LaBeouf retriever. Loves cold weather. 4 smaller dogs are his sons (probably). 10/10 https://t.co/Ko7eCsFpnI,10,10,Banditt,112,384,malinois,100.0,None
668852170888998912,2015-11-23 18:02:38+00:00,Say hello to Bobb. Bobb is a Golden High Fescue &amp; a proud father of 8. Bobb sleeps while the little pups play. 11/10 https://t.co/OmxouCZ8IY,11,10,Bobb,139,410,golden_retriever,110.00000000000001,None
668872652652679168,2015-11-23 19:24:02+00:00,This is Amélie. She is a confident white college girl. Extremely intimidating. Literally can't rn omg. 11/10 fab https://t.co/up0MHRxelf,11,10,Amélie,268,477,miniature_schnauzer,110.00000000000001,None
668892474547511297,2015-11-23 20:42:48+00:00,This is Ruffles. He is an Albanian Shoop Da Whoop. He just noticed the camera. Patriotic af. Classy hardwood. 11/10 https://t.co/HyDpTU5Jhj,11,10,Ruffles,126,354,kelpie,110.00000000000001,None
668902994700836864,2015-11-23 21:24:36+00:00,Meet Lambeau. He's a Whistling Haiku from the plains of southern Guatemala. 11/10 so. damn. majestic. https://t.co/UqCvpSgMJe,11,10,Lambeau,88,276,Brittany_spaniel,110.00000000000001,None
