tweet_id,timestamp,text,rating_numerator,rating_denominator,name,retweet_count,favorite_count,dog_breed,rating,dog_stage
780858289093574656,2016-09-27 19:54:58+00:00,"This is Dash. He's very stylish, but also incredibly unimpressed with the current state of our nation. 10/10 would pet ears first https://t.co/YElO4hvXI6",10,10,Dash,1868,6808,Chesapeake_Bay_retriever,100.0,None
781163403222056960,2016-09-28 16:07:23+00:00,"We normally don't rate lobsters, but this one appears to be a really good lobster. 10/10 would pet with caution https://t.co/YkHc7U7uUy",10,10,None,2585,9283,Shetland_sheepdog,100.0,None
781524693396357120,2016-09-29 16:03:01+00:00,Idk why this keeps happening. We only rate dogs. Not Bangladeshi Couch Chipmunks. Please only send dogs... 12/10 https://t.co/ya7bviQUUf,12,10,None,5149,19605,Labrador_retriever,120.0,None
781661882474196992,2016-09-30 01:08:10+00:00,Who keeps sending in pictures without dogs in them? This needs to stop. 5/10 for the mediocre road https://t.co/ELqelxWMrC,5,10,None,2529,9888,Pembroke,50.0,None
782021823840026624,2016-10-01 00:58:26+00:00,RT @dog_rates: This is Harper. She scraped her elbow attempting a backflip off a tree. Valiant effort tho. 12/10 https://t.co/oHKJHghrp5,12,10,Harper,5743,0,golden_retriever,120.0,None
782305867769217024,2016-10-01 19:47:08+00:00,This is Sampson. He just graduated. Ready to be a doggo now. Time for the real world. 12/10 have fun with taxes https://t.co/pgVKxRw0s1,12,10,Sampson,5130,15720,briard,120.0,doggo
782598640137187329,2016-10-02 15:10:30+00:00,This is Timmy. He's quite large. According to a trusted source it's actually a dog wearing a dog suit. 11/10 https://t.co/BIUchFwHqn,11,10,Timmy,1768,7386,malamute,110.00000000000001,None
782722598790725632,2016-10-02 23:23:04+00:00,"This is Penny. She fought a bee and the bee won. 10/10 you're fine Penny, everything's fine https://t.co/zrMVdfFej6",10,10,Penny,5020,16309,Irish_setter,100.0,None
782747134529531904,2016-10-03 01:00:34+00:00,This is Deacon. He's the happiest almost dry doggo I've ever seen. 11/10 would smile back https://t.co/C6fUMnHt1H,11,10,Deacon,1319,7074,golden_retriever,110.00000000000001,doggo
782969140009107456,2016-10-03 15:42:44+00:00,This is Cali. She arrived preassembled. Convenient af. 12/10 appears to be rather h*ckin pettable https://t.co/vOBV1ZqVcX,12,10,Cali,6895,22837,Labrador_retriever,120.0,None
783085703974514689,2016-10-03 23:25:55+00:00,This is Earl. He can't catch. Did his best tho. 11/10 would repair confidence with extra pats https://t.co/IsqyvbjFgM,11,10,Earl,2021,7742,Chesapeake_Bay_retriever,110.00000000000001,None
783347506784731136,2016-10-04 16:46:14+00:00,RT @dog_rates: This is Kenny. He just wants to be included in the happenings. 11/10 https://t.co/2S6oye3XqK,11,10,Kenny,5150,0,Cardigan,110.00000000000001,None
783466772167098368,2016-10-05 00:40:09+00:00,This is Finn. He likes eavesdropping from filing cabinets. It's a real issue but no one has approached him about it. 11/10 would still pet https://t.co/s8W8Del9HQ,11,10,Finn,2076,7990,Chihuahua,110.00000000000001,None
783821107061198850,2016-10-06 00:08:09+00:00,This is Mairi. She has mastered the art of camouflage. 12/10 h*ckin sneaky af https://t.co/STcPjiNAHp,12,10,Mairi,1830,6991,Lakeland_terrier,120.0,None
784431430411685888,2016-10-07 16:33:21+00:00,This is Stormy. He's curly af. Already pupared for Coachella next year. 12/10 https://t.co/PHA1vtqqpt,12,10,Stormy,1184,5449,miniature_poodle,120.0,None
784826020293709826,2016-10-08 18:41:19+00:00,This is Rusty. He's going D1 for sure. Insane vertical. 13/10 would draft https://t.co/AsykOwMrXQ,13,10,Rusty,3013,9582,chow,130.0,None
785264754247995392,2016-10-09 23:44:41+00:00,This is Doc. He requested to be carried around like that. 12/10 anything for Doc https://t.co/mWYACm4qnx,12,10,Doc,1520,6912,chow,120.0,None
785872687017132033,2016-10-11 16:00:24+00:00,Meet Rusty. He appears to be rather h*ckin fluffy. Also downright adorable af. 12/10 would rub my face against his https://t.co/1j9kLGb4wV,12,10,Rusty,1674,6351,Great_Pyrenees,120.0,None
785927819176054784,2016-10-11 19:39:28+00:00,This is Lucy. She's strives to be the best potato she can be. 12/10 would boop https://t.co/lntsj7Fc4Y,12,10,Lucy,2993,10821,chow,120.0,None
786036967502913536,2016-10-12 02:53:11+00:00,RT @dog_rates: This is Scout. He really wants to kiss himself. H*ckin inappropriate. 11/10 narcissistic af https://t.co/x0gV2Ck3AD,11,10,Scout,6506,0,golden_retriever,110.00000000000001,None
786233965241827333,2016-10-12 15:55:59+00:00,This is Mattie. She's extremely dangerous. Will bite your h*ckin finger right off. Still 11/10 would pet with caution https://t.co/78c9W8kLFh,11,10,Mattie,4385,14418,Labrador_retriever,110.00000000000001,None
786363235746385920,2016-10-13 00:29:39+00:00,This is Rizzo. He has many talents. A true renaissance doggo. 13/10 entertaining af https://t.co/TVXpEJB7Wn,13,10,Rizzo,3223,10287,golden_retriever,130.0,doggo
786595970293370880,2016-10-13 15:54:28+00:00,This is Dale. He's a real spookster. Did me quite the frighten. 11/10 not too spooky to pet tho https://t.co/L8BWDD4oBX,11,10,Dale,2922,8986,Pembroke,110.00000000000001,None
786664955043049472,2016-10-13 20:28:35+00:00,"""Honestly Kathleen I just want more Ken Bone"" 12/10 https://t.co/HmlEvAMP4r",12,10,None,2367,10058,Leonberg,120.0,None
786709082849828864,2016-10-13 23:23:56+00:00,"This is Logan, the Chow who lived. He solemnly swears he's up to lots of good. H*ckin magical af 9.75/10 https://t.co/yBO5wuqaPS",75,10,Logan,5736,17374,Pomeranian,750.0,None
786963064373534720,2016-10-14 16:13:10+00:00,This is Rory. He's got an interview in a few minutes. Looking spiffy af. Nervous as h*ck tho. 12/10 would hire https://t.co/ibj5g6xaAj,12,10,Rory,7439,25303,golden_retriever,120.0,None
787397959788929025,2016-10-15 21:01:17+00:00,This is Moose. He's rather h*ckin dangerous (you can tell by the collar). 11/10 would still attempt to snug https://t.co/lHVHGdDzb3,11,10,Moose,2670,10340,Chihuahua,110.00000000000001,None
788070120937619456,2016-10-17 17:32:13+00:00,RT @dog_rates: This is Bo and Ty. Bo eats paper and Ty felt left out. 11/10 for both https://t.co/1acHQS8rvK,11,10,Bo,3217,0,golden_retriever,110.00000000000001,None
788412144018661376,2016-10-18 16:11:17+00:00,This is Dexter. He breaks hearts for a living. 11/10 h*ckin handsome af https://t.co/4DhSsC1W7S,11,10,Dexter,4933,14738,golden_retriever,110.00000000000001,None
788765914992902144,2016-10-19 15:37:03+00:00,This is Butter. She can have whatever she wants forever. 12/10 would hug softly https://t.co/x5gXRS1abq,12,10,Butter,9672,25937,cocker_spaniel,120.0,None
788908386943430656,2016-10-20 01:03:11+00:00,"This is Lucy. She destroyed not one, but two remotes trying to turn off the debate. 11/10 relatable af https://t.co/3BXh073tDm",11,10,Lucy,11720,26095,golden_retriever,110.00000000000001,None
789268448748703744,2016-10-21 00:53:56+00:00,This is Stella. She's happier than I will ever be. 10/10 would trade lives with https://t.co/JSs2bfDtTS,10,10,Stella,2450,8669,malamute,100.0,None
789628658055020548,2016-10-22 00:45:17+00:00,This is Eli. He can fly. 13/10 magical af https://t.co/huPSJJ7FDI,13,10,Eli,1652,7086,chow,130.0,None
789986466051088384,2016-10-23 00:27:05+00:00,This is Happy. He's a bathtub reviewer. Seems to be pleased with this one. 12/10 https://t.co/Ln89R4FP7v,12,10,Happy,2148,8811,golden_retriever,120.0,None
790277117346975746,2016-10-23 19:42:02+00:00,This is Bruce. He never backs down from a challenge. 11/10 you got this Bruce https://t.co/aI7umZHIq7,11,10,Bruce,2960,11914,Labrador_retriever,110.00000000000001,None
790337589677002753,2016-10-23 23:42:19+00:00,Meet Maggie. She can hear your cells divide. 12/10 can also probably fly https://t.co/ovE2hqXryV,12,10,Maggie,1770,7422,Pembroke,120.0,None
790698755171364864,2016-10-24 23:37:28+00:00,This is Mosby. He appears to be rather h*ckin snuggable af. 12/10 keep it up Mosby https://t.co/IiiBq460I7,12,10,Mosby,1808,7808,Bernese_mountain_dog,120.0,None
790723298204217344,2016-10-25 01:14:59+00:00,RT @dog_rates: This is Happy. He's a bathtub reviewer. Seems to be pleased with this one. 12/10 https://t.co/Ln89R4FP7v,12,10,Happy,2148,0,golden_retriever,120.0,None
790946055508652032,2016-10-25 16:00:09+00:00,This is Betty. She's assisting with the dishes. Such a good puppo. 12/10 h*ckin helpful af https://t.co/dgvTPZ9tgI,12,10,Betty,4394,15875,chow,120.0,puppo
790987426131050500,2016-10-25 18:44:32+00:00,This is Misty. She has a cowboy hat on her nose. 12/10 https://t.co/Eno0mypHIr,12,10,Misty,1992,9316,cocker_spaniel,120.0,None
791026214425268224,2016-10-25 21:18:40+00:00,RT @dog_rates: This is Alfie. He's touching a butt. Couldn't be happier. 11/10 https://t.co/gx3xF5mZbo,11,10,Alfie,3822,0,malamute,110.00000000000001,None
791672322847637504,2016-10-27 16:06:04+00:00,When she says you're a good boy and you know you're a good boy because you're a good boy. 13/10 https://t.co/O5IUmRHRIh,13,10,None,2932,11159,golden_retriever,130.0,None
792773781206999040,2016-10-30 17:02:53+00:00,This is Monster. Not an actual monster tho. He's showing you his tongue. Very impressive Monster. 12/10 would snug https://t.co/RhaPExuxJL,12,10,Monster,1573,7003,Yorkshire_terrier,120.0,None
793120401413079041,2016-10-31 16:00:13+00:00,"This is Robin. She's desperately trying to do me a frighten, but her tongue drastically decreases her spook value. Still 11/10 great effort https://t.co/sxMrsOZ8zb",11,10,Robin,3693,12038,Labrador_retriever,110.00000000000001,None
793150605191548928,2016-10-31 18:00:14+00:00,This is Nida. She's a free elf. Waited so long for this day. 11/10 https://t.co/3lE8Izgmkf,11,10,Nida,1598,5858,Italian_greyhound,110.00000000000001,None
793165685325201412,2016-10-31 19:00:10+00:00,This is Benji. He's Air Bud. It's a low effort costume but he pulls it off rather h*ckin well. 12/10 would happily get dunked on https://t.co/IbzT7DJvBo,12,10,Benji,2630,8917,golden_retriever,120.0,None
793180763617361921,2016-10-31 20:00:05+00:00,This is Newt. He's a strawberry. 11/10 https://t.co/2VhmlwxA1Q,11,10,Newt,1867,6575,Lakeland_terrier,110.00000000000001,None
793210959003287553,2016-10-31 22:00:04+00:00,This is Maude. She's the h*ckin happiest wasp you've ever seen. 10/10 would pet with caution https://t.co/etL8FHBrh8,10,10,Maude,2614,8490,Boston_bull,100.0,None
793226087023144960,2016-10-31 23:00:11+00:00,"This is Juno. She spooked me up real good, but only to get my attention. Above average handwriting for a dog I think. 11/10 https://t.co/hFxxBCWlwj",11,10,Juno,2719,9294,wire-haired_fox_terrier,110.00000000000001,None
793241302385262592,2016-11-01 00:00:38+00:00,This is Tucker. He's out here bustin h*ckin ghosts. 13/10 dedicated af https://t.co/Ap477GhwXt,13,10,Tucker,3080,10003,golden_retriever,130.0,None
793256262322548741,2016-11-01 01:00:05+00:00,Oh h*ck look at this spookling right here. Fright level off the charts. 12/10 sufficiently spooked https://t.co/BNy9IIJMb0,12,10,None,7813,18956,basset,120.0,None
793271401113350145,2016-11-01 02:00:14+00:00,Meet Dave. It's his favorite day of the year. He gets to fulfill his dream of being a dinosaur. 12/10 inspirational af https://t.co/MgQSdfZGPN,12,10,Dave,2249,8261,Siberian_husky,120.0,None
793286476301799424,2016-11-01 03:00:09+00:00,This is Moreton. He's the Good Boy Who Lived. 13/10 magical as h*ck https://t.co/rLHGx3VAF3,13,10,Moreton,8604,23369,Afghan_hound,130.0,None
793601777308463104,2016-11-01 23:53:02+00:00,This is Dobby. I can't stop looking at her feet. 12/10 would absolutely snug https://t.co/LhzPWv6rTv,12,10,Dobby,1519,7587,miniature_pinscher,120.0,None
793614319594401792,2016-11-02 00:42:53+00:00,RT @dog_rates: When she says you're a good boy and you know you're a good boy because you're a good boy. 13/10 https://t.co/O5IUmRHRIh,13,10,None,2932,0,golden_retriever,130.0,None
793845145112371200,2016-11-02 16:00:06+00:00,This is Clark. He was just caught wearing pants. 13/10 game-changing af https://t.co/2Xo19aPrG5,13,10,Clark,1750,8781,Old_English_sheepdog,130.0,None
793962221541933056,2016-11-02 23:45:19+00:00,This is Maximus. His face is stuck like that. Tragic really. Great tongue tho. 12/10 would pet firmly https://t.co/xIfrsMNLBR,12,10,Maximus,4583,15924,Labrador_retriever,120.0,None
794332329137291264,2016-11-04 00:15:59+00:00,This is Nimbus (like the cloud). He just bought this fancy af duck raincoat. Only protects one ear tho. 12/10 so h*ckin floofy https://t.co/SIQbb8c3AU,12,10,Nimbus,2540,9142,Samoyed,120.0,None
794355576146903043,2016-11-04 01:48:22+00:00,RT @dog_rates: This is Butter. She can have whatever she wants forever. 12/10 would hug softly https://t.co/x5gXRS1abq,12,10,Butter,9672,0,cocker_spaniel,120.0,None
794926597468000259,2016-11-05 15:37:24+00:00,This is Mack. He's rather h*ckin sleepy. Exceptional ears. 12/10 would boop https://t.co/XRPvTPF0VH,12,10,Mack,2163,9692,toy_poodle,120.0,None
795464331001561088,2016-11-07 03:14:10+00:00,Elder doggo does a splash. Both 13/10 incredible stuff https://t.co/gBUDjdEcqz,13,10,None,21993,46845,golden_retriever,130.0,doggo
796031486298386433,2016-11-08 16:47:50+00:00,This is Daisy. She's here to make your day better. 13/10 mission h*ckin successful https://t.co/PbgvuD0qIL,13,10,Daisy,3503,10284,golden_retriever,130.0,None
796080075804475393,2016-11-08 20:00:55+00:00,This is Yogi. He's 98% floof. Snuggable af. 12/10 https://t.co/opoXKxmfFm,12,10,Yogi,2171,8028,chow,120.0,None
796116448414461957,2016-11-08 22:25:27+00:00,I didn't believe it at first but now I can see that voter fraud is a serious h*ckin issue. 11/10 https://t.co/7i0bDMbrVN,11,10,None,2254,8651,Cardigan,110.00000000000001,None
796149749086875649,2016-11-09 00:37:46+00:00,This is Ruby. She just turned on the news. Officially terrified. 11/10 deep breaths Ruby https://t.co/y5KarNXWXt,11,10,Ruby,13391,30551,golden_retriever,110.00000000000001,None
796177847564038144,2016-11-09 02:29:25+00:00,RT @dog_rates: This is Ruby. She just turned on the news. Officially terrified. 11/10 deep breaths Ruby https://t.co/y5KarNXWXt,11,10,Ruby,13391,0,golden_retriever,110.00000000000001,None
796387464403357696,2016-11-09 16:22:22+00:00,This is Snicku. He's having trouble reading because he's a dog. Glasses only helped a little. Nap preferred. 12/10 would snug well https://t.co/cVLUasbKA5,12,10,Snicku,3894,10469,Pekinese,120.0,None
796484825502875648,2016-11-09 22:49:15+00:00,Here's a sleepy doggo that requested some assistance. 12/10 would carry everywhere https://t.co/bvkkqOjNDV,12,10,None,1654,7191,cocker_spaniel,120.0,doggo
796759840936919040,2016-11-10 17:02:03+00:00,Say hello to Romeo. He was just told that it's too cold for the pool. H*ckin nonsense. 11/10 would help fill up https://t.co/6hx7ur6sNI,11,10,Romeo,2837,11218,American_Staffordshire_terrier,110.00000000000001,None
796865951799083009,2016-11-11 00:03:42+00:00,This is Tyr. He's just checking on you. Nifty af tongue slip. 12/10 would absolutely pet https://t.co/Jgnuiyvq06,12,10,Tyr,1830,7318,Cardigan,120.0,None
797545162159308800,2016-11-12 21:02:38+00:00,This is Cassie. She steals things. Guilt increases slightly each time. 12/10 would forgive almost immediately https://t.co/Ia19irLwyB,12,10,Cassie,4621,13893,Pembroke,120.0,None
797971864723324932,2016-11-14 01:18:12+00:00,Here's a helicopter pupper. He takes off at random. H*ckin hard to control. 12/10 rare af https://t.co/GRWPgNKt2z,12,10,None,2893,10966,American_Staffordshire_terrier,120.0,pupper
798209839306514432,2016-11-14 17:03:50+00:00,This is Cooper. His bow tie was too heavy for the front so he moved it to the side. Balanced af now. 13/10 https://t.co/jG1PAFkB81,13,10,Cooper,2425,9931,Pekinese,130.0,None
798340744599797760,2016-11-15 01:44:00+00:00,RT @dog_rates: This is Davey. He'll have your daughter home by 8. Just a stand up pup. 11/10 would introduce to mom https://t.co/E6bGWf9EOm,11,10,Davey,3143,0,papillon,110.00000000000001,None
798628517273620480,2016-11-15 20:47:30+00:00,RT @dog_rates: This a Norwegian Pewterschmidt named Tickles. Ears for days. 12/10 I care deeply for Tickles https://t.co/0aDF62KVP7,12,10,None,1867,0,beagle,120.0,None
798644042770751489,2016-11-15 21:49:12+00:00,RT @dog_rates: This is Paull. He just stubbed his toe. 10/10 deep breaths Paull https://t.co/J5Mqn8VeYq,10,10,Paull,1747,0,English_springer,100.0,None
798665375516884993,2016-11-15 23:13:58+00:00,RT @dog_rates: This is Lola. She fell asleep on a piece of pizza. 10/10 frighteningly relatable https://t.co/eqmkr2gmPH,10,10,Lola,3679,0,chow,100.0,None
798694562394996736,2016-11-16 01:09:57+00:00,"RT @dog_rates: I'm not sure what's happening here, but it's pretty spectacular. 12/10 for both https://t.co/JKXh0NbBNL",12,10,None,4645,0,Chihuahua,120.0,None
798697898615730177,2016-11-16 01:23:12+00:00,RT @dog_rates: This is Stubert. He just arrived. 10/10 https://t.co/HVGs5aAKAn,10,10,Stubert,6104,0,Labrador_retriever,100.0,None
798925684722855936,2016-11-16 16:28:21+00:00,This is Shadow. He's a firm believer that they're all good dogs. H*ckin passionate about it too. 11/10 I stand with Shadow https://t.co/8yvpacwBcu,11,10,Shadow,1362,7164,West_Highland_white_terrier,110.00000000000001,None
798933969379225600,2016-11-16 17:01:16+00:00,This is Iroh. He's in a predicament. 12/10 someone help him https://t.co/KJAKO2kXsL,12,10,Iroh,4162,12435,Siberian_husky,120.0,None
799297110730567681,2016-11-17 17:04:16+00:00,This is Jeffrey. He's quite the jokester. Takes it too far sometimes. Still 11/10 would pet https://t.co/YDtZcAiMAf,11,10,Jeffrey,2569,9393,malamute,110.00000000000001,None
799422933579902976,2016-11-18 01:24:14+00:00,This is Longfellow (prolly sophisticated). He's a North Appalachian Oatzenjammer. Concerned about wrinkled feets. 12/10 would hug softly https://t.co/bpLuQuxzHZ,12,10,Longfellow,1801,7691,miniature_pinscher,120.0,None
799757965289017345,2016-11-18 23:35:32+00:00,This is Sobe. She's a h*ckin happy doggo. Only one leg tho. Must have good balance. 13/10 would smile back https://t.co/OiH8PaOxB1,13,10,Sobe,2004,7983,Border_collie,130.0,doggo
799774291445383169,2016-11-19 00:40:24+00:00,RT @dog_rates: This is Tucker. He would like a hug. 13/10 someone hug him https://t.co/wdgY9oHPrT,13,10,Tucker,4376,0,chow,130.0,None
800513324630806528,2016-11-21 01:37:04+00:00,This is Chef. Chef loves everyone and wants everyone to love each other. 11/10 https://t.co/ILHGs0e6Dm,11,10,Chef,2834,12510,Pembroke,110.00000000000001,None
801115127852503040,2016-11-22 17:28:25+00:00,This is Bones. He's being haunted by another doggo of roughly the same size. 12/10 deep breaths pupper everything's fine https://t.co/55Dqe0SJNj,12,10,Bones,1986,7684,dalmatian,120.0,doggo
801167903437357056,2016-11-22 20:58:07+00:00,This is Milo. I would do terrible things for Milo. 13/10 https://t.co/R6wJyC2Tey,13,10,Milo,5526,23200,cocker_spaniel,130.0,None
801538201127157760,2016-11-23 21:29:33+00:00,This is Wallace. He'll be your chau-fur this evening. 12/10 eyes on the road Wallace https://t.co/p1RD39XjUe,12,10,Wallace,1954,7824,Pembroke,120.0,None
801958328846974976,2016-11-25 01:18:59+00:00,This is Ronnie. He hopes you're having a great day. Nifty tongue slip. 12/10 would pat head approvingly https://t.co/4fY2bsAm65,12,10,Ronnie,1598,7371,Staffordshire_bullterrier,120.0,None
802572683846291456,2016-11-26 18:00:13+00:00,This is Winnie. She's h*ckin ferocious. Dandelion doesn't even see her coming. 12/10 would pet with caution https://t.co/EFfLCP7oQv,12,10,Winnie,2360,8526,golden_retriever,120.0,None
802624713319034886,2016-11-26 21:26:58+00:00,"RT @dog_rates: ""Yep... just as I suspected. You're not flossing."" 12/10 and 11/10 for the pup not flossing https://t.co/SuXcI9B7pQ",12,10,None,2727,0,cocker_spaniel,120.0,None
802952499103731712,2016-11-27 19:09:28+00:00,This is Marley. She's having a ruff day. Pretty pupset. 12/10 would assist https://t.co/yLm7hQ6UXh,12,10,Marley,1875,8583,chow,120.0,None
803276597545603072,2016-11-28 16:37:19+00:00,This is Winston. His selfie game is legendary. Will steal your girl with a single snap. 11/10 handsome as h*ck https://t.co/jxQhxoPsgL,11,10,Winston,2300,9561,Pembroke,110.00000000000001,None
803638050916102144,2016-11-29 16:33:36+00:00,Pupper hath acquire enemy. 13/10 https://t.co/ns9qoElfsX,13,10,None,3887,10385,Labrador_retriever,130.0,pupper
803692223237865472,2016-11-29 20:08:52+00:00,RT @dog_rates: I present to you... Dog Jesus. 13/10 (he could be sitting on a rock but I doubt it) https://t.co/fR1P3g5I6k,13,10,None,6932,0,Lakeland_terrier,130.0,None
804413760345620481,2016-12-01 19:56:00+00:00,RT @dog_rates: This is Rusty. He's going D1 for sure. Insane vertical. 13/10 would draft https://t.co/AsykOwMrXQ,13,10,Rusty,3013,0,chow,130.0,None
804738756058218496,2016-12-02 17:27:25+00:00,This is Django. He accidentally opened the front facing camera. Did him quite the frighten. 12/10 https://t.co/kQVQoOW9NZ,12,10,Django,3604,12998,Tibetan_mastiff,120.0,None
805207613751304193,2016-12-04 00:30:29+00:00,This is Shooter. He's doing quite the snowy zoom. 12/10 https://t.co/lHy4Xbyhd9,12,10,Shooter,1629,7484,Pembroke,120.0,None
805520635690676224,2016-12-04 21:14:20+00:00,This is Zeke the Wonder Dog. He never let that poor man keep his frisbees. One of the Spartans all time greatest receivers. 13/10 RIP Zeke https://t.co/zacX7S6GyJ,13,10,Zeke,1552,5488,malinois,130.0,None
805826884734976000,2016-12-05 17:31:15+00:00,This is Duke. He is not a fan of the pupporazzi. 12/10 https://t.co/SgpBVYIL18,12,10,Duke,1717,6246,Siberian_husky,120.0,None
805932879469572096,2016-12-06 00:32:26+00:00,This is Major. He put on a tie for his first real walk. Only a little crooked. Can also drool upwards. H*ckin talented. 12/10 https://t.co/Zcwr8LgoO8,12,10,Major,1803,7886,Norwegian_elkhound,120.0,None
805958939288408065,2016-12-06 02:15:59+00:00,"RT @dog_rates: This is Penny. She fought a bee and the bee won. 10/10 you're fine Penny, everything's fine https://t.co/zrMVdfFej6",10,10,Penny,5020,0,Irish_setter,100.0,None
806219024703037440,2016-12-06 19:29:28+00:00,We only rate dogs. Please stop sending in non-canines like this Freudian Poof Lion. This is incredibly frustrating... 11/10 https://t.co/IZidSrBvhi,11,10,incredibly,1134,6138,chow,110.00000000000001,None
806542213899489280,2016-12-07 16:53:43+00:00,This is Waffles. He's concerned that the dandruff shampoo he just bought is faulty. 11/10 tragic af https://t.co/BCB87qUU0h,11,10,Waffles,2219,9745,vizsla,110.00000000000001,None
807010152071229440,2016-12-08 23:53:08+00:00,This is Lennon. He's a Boopershnoop Pupperdoop. Quite rare. Exceptionally pettable. 12/10 would definitely boop that shnoop https://t.co/fhgP6vSfhX,12,10,Lennon,3638,12477,golden_retriever,120.0,None
807059379405148160,2016-12-09 03:08:45+00:00,RT @dog_rates: This is Cali. She arrived preassembled. Convenient af. 12/10 appears to be rather h*ckin pettable https://t.co/vOBV1ZqVcX,12,10,Cali,6895,0,Labrador_retriever,120.0,None
807106840509214720,2016-12-09 06:17:20+00:00,This is Stephan. He just wants to help. 13/10 such a good boy https://t.co/DkBYaCAg2d,13,10,Stephan,51702,111728,Chihuahua,130.0,None
808001312164028416,2016-12-11 17:31:39+00:00,This is Cooper. He likes to stick his tongue out at you and then laugh about it. 12/10 quite the jokester https://t.co/O9iGgvfuzl,12,10,Cooper,3318,11858,Labrador_retriever,120.0,None
808106460588765185,2016-12-12 00:29:28+00:00,Here we have Burke (pupper) and Dexter (doggo). Pupper wants to be exactly like doggo. Both 12/10 would pet at same time https://t.co/ANBpEYHaho,12,10,None,2069,8385,golden_retriever,120.0,doggo
808134635716833280,2016-12-12 02:21:26+00:00,RT @dog_rates: This is Milo. I would do terrible things for Milo. 13/10 https://t.co/R6wJyC2Tey,13,10,Milo,5526,0,cocker_spaniel,130.0,None
808733504066486276,2016-12-13 18:01:07+00:00,Here's a pupper in a onesie. Quite pupset about it. Currently plotting revenge. 12/10 would rescue https://t.co/xQfrbNK3HD,12,10,None,2034,7511,golden_retriever,120.0,pupper
808838249661788160,2016-12-14 00:57:20+00:00,This is Ito. He'll be your uber driver tonight. Currently adjusting the mirrors. 13/10 incredibly h*ckin responsible https://t.co/Zrrcw29o13,13,10,Ito,2868,9649,Rottweiler,130.0,None
809084759137812480,2016-12-14 17:16:53+00:00,"This is Wallace. You said you brushed your teeth but he checked your toothbrush and it was bone dry. 11/10 not pupset, just disappointed https://t.co/nadm8yWZ4h",11,10,Wallace,3307,12571,vizsla,110.00000000000001,None
809220051211603969,2016-12-15 02:14:29+00:00,This is Kyro. He's a Stratocumulus Flop. Tongue ejects at random. Serious h*ckin condition. Still 12/10 would pet passionately https://t.co/wHu15q2Q6p,12,10,Kyro,5254,18905,Pomeranian,120.0,None
809448704142938112,2016-12-15 17:23:04+00:00,"I call this one ""A Blep by the Sea"" 12/10 https://t.co/EMdnCugNbo",12,10,None,1371,6615,Greater_Swiss_Mountain_dog,120.0,None
809808892968534016,2016-12-16 17:14:20+00:00,RT @dog_rates: This is Maximus. His face is stuck like that. Tragic really. Great tongue tho. 12/10 would pet firmly https://t.co/xIfrsMNLBR,12,10,Maximus,4583,0,Labrador_retriever,120.0,None
809920764300447744,2016-12-17 00:38:52+00:00,"Please only send in dogs. We only rate dogs, not seemingly heartbroken ewoks. Thank you... still 10/10 would console https://t.co/HIraYS1Bzo",10,10,None,3686,14789,Norwich_terrier,100.0,None
810254108431155201,2016-12-17 22:43:27+00:00,"This is Gus. He likes to be close to you, which is good because you want to be close to Gus. 12/10 would boop then pet https://t.co/DrsrQkEfnb",12,10,Gus,3169,13984,Staffordshire_bullterrier,120.0,None
810284430598270976,2016-12-18 00:43:57+00:00,This is Phil. He's a father. A very good father too. 13/10 everybody loves Phil https://t.co/9p6ECXJMMu,13,10,Phil,10503,33346,malamute,130.0,None
